decision_id	timestamp_utc	session_branch	task_summary	decision_axis	decision	rationale	authority_citations	in_envelope_item	escalated	evidence_paths	agent_invoking
OPD-20260514-001	2026-05-14T03:00:00Z	agent/brand-wizard-composite-mode-20260514	brand-wizard composite-mode + catalog planner mode-shim	scope_sequence	Ship composite-mode UI (teacher_showcase + 4 BrandWizard.jsx variants) + planner shim in one PR; defer brand-admin YAML wire-up to a follow-up	Cheapest gap first: UI + emit contract before runtime wire-up; planner shim is additive and back-compat with all existing callers (overrides default None). No clobber of in-flight work.	docs/PEARL_OPERATOR_PROXY_SPEC.md (in-envelope §5); brand-wizard-app/src/BrandWizard.jsx:3287-3300 emit contract; scripts/catalog/music_mode_branch.py:96-128 composite enum alignment; feedback_validation_before_scaling.md	5	no	brand-wizard-app/public/teacher_showcase.html;brand-wizard-app/src/BrandWizard.jsx;brand-wizard-app/src/BrandWizard-{ja,tw,zh}.jsx;scripts/catalog/generate_pearl_prime_book_script_catalog.py	Pearl_Dev
OPD-20260514-002	2026-05-14T03:05:00Z	agent/brand-wizard-composite-mode-20260514	i18n strings for composite UI	read_only_artifact	Inline translations into teacher_showcase.html TEACHER_LABELS (4 locales); skip strings-*.json additions because no new wizard-side t("ui",...) calls were introduced	Composite flow skips wizard intro before any new wizard string would render (?mode=composite triggers skip-intro effect). All new user-visible strings are owned by the static page's own dict. Avoids touching 4 locale strings files for unused keys.	brand-wizard-app/src/useTranslation.jsx:14-20 (en returns key directly); brand-wizard-app/public/teacher_showcase.html:10212-10221 TEACHER_LABELS contract	7	no	brand-wizard-app/public/teacher_showcase.html	Pearl_Dev
OPD-20260514-003	2026-05-14T03:10:00Z	agent/brand-wizard-composite-mode-20260514	panel render path (handoff §6.2)	model_path	Canonical color/face panel path = Pearl Star Qwen-Image; B&W panels = Animagine XL 4.0 + per-genre LoRA; face-lock = PuLID-FLUX-FaceNet; ai-toolkit LoRAs for 12-14 recurring cast only; panel PROMPT generation is in-envelope, panel DISPATCH stays operator-gated	V2 layered architecture per docs/CHARACTER_INDIVIDUATION_PIPELINE_SPEC_2026-05-02.md §2.3-§2.4 + PR #1018 Qwen-Image complete + project_known_good_anchors.md Manga V2 entry. No FLUX-for-faces drift; no paid path until canary signal.	docs/PEARL_OPERATOR_PROXY_SPEC.md (in-envelope §2); project_known_good_anchors.md; PR #924/925/926/988/1018/1046/1048/1086/1094	2	no	(carries to follow-up V2 canary generation sub-task)	Pearl_PM
OPD-20260514-004	2026-05-14T03:12:00Z	agent/brand-wizard-composite-mode-20260514	JP ≥85% atom backfill priority (handoff §6.3)	scope_sequence	Rank ws_ja_jp_atom_backfill_phase_2_20260513 above arc_roadmap retrofit when both are runnable	JP backfill unblocks bestseller manga shipment per handoff §6.3; arc_roadmap retrofit is V2-canary cosmetic. Bias: fill smallest cheapest gap that unblocks downstream first.	docs/PEARL_OPERATOR_PROXY_SPEC.md (in-envelope §5); artifacts/coordination/HANDOFF_2026_05_13.md	5	no	(carries to Pearl_Editor next session)	Pearl_PM
OPD-20260514-005	2026-05-14T03:15:00Z	agent/brand-wizard-composite-mode-20260514	5 mergeable PRs labeling	subagent_dispatch	Proxy will run pre_merge_check.sh + gh pr diff --stat for #1086/#1088/#1091/#1093/#1095 in Phase 2 audit and surface a recommended merge order; merge action itself stays operator-only	docs/PEARL_OPERATOR_PROXY_SPEC.md out-of-envelope §5 (merging PRs to main = operator). Proxy can prep + label + recommend, never merge.	docs/PEARL_OPERATOR_PROXY_SPEC.md (in-envelope §6, out-of-envelope §5); CLAUDE.md §0 mass-deletion guard	6	partial	(carried to Phase 2 audit below)	Pearl_PM
OPD-20260514-006	2026-05-14T03:55:00Z	agent/brand-wizard-composite-mode-20260514	5 mergeable PRs audit + merge order	subagent_dispatch	#1086/#1088/#1091/#1093 already MERGED (prompt list was stale); only #1095 still OPEN. Recommend operator merge order: Tier-A (small, all governance-passing) #1111 (this PR) → #1104 (Pearl_Operator_Proxy spec+log scaffold) → #1096 (pearl_news no-drift audit) → #1095 (handoff persist; UNSTABLE only due to "Workers Builds: pearl-prime" FAILURE which also fails on #1092, suggesting main-branch worker issue not PR content). Tier-B blocked: #1092 (276,944 additions, "No binary blobs" check FAILS by design — PR commits cover assets in violation of repo policy; needs operator decision: bypass check OR move covers to R2 + reauthor).	docs/PEARL_OPERATOR_PROXY_SPEC.md (in-envelope §6, out-of-envelope §5); CLAUDE.md §0 mass-deletion guard; .github/workflows/no_binary_blobs.yml	6	partial	artifacts/coordination/operator_decisions_log.tsv	Pearl_PM
OPD-20260514-007	2026-05-14T03:58:00Z	agent/brand-wizard-composite-mode-20260514	Phase 2 background subagent footprint audit	read_only_artifact	No filesystem evidence in this worktree for cover Phase 2 (PR #1092 carries the data on its own branch), legacy 13 cover re-renders, fantasy_adventure backfill, arc_roadmap retrofit, or V2 canary 8-series generation. All background work lives on subagent branches not yet in origin/main. Operator should query each subagent's branch directly via gh pr view + git worktree list rather than rely on this worktree.	docs/PEARL_OPERATOR_PROXY_SPEC.md (in-envelope §7); feedback_drift_recovery_git_first.md	7	no	artifacts/coordination/operator_decisions_log.tsv	Pearl_PM
OPD-20260514-008	2026-05-14T04:30:00Z	agent/brand-wizard-composite-mode-20260514	Cloudflare local-preview deploy — Path B closeout	scope_sequence	Take Path B: skip local branch-preview deploy for PR #1111; rely on CI workflow auto-deploy on merge to main. Generated cfut_yESN9R token in portal but cfut_ prefix is hard-locked by Cloudflare to Workers Builds scope + CI infrastructure IPs (verified: HTTP 200 verify, HTTP 403 Pages). No autonomous fix possible — Custom Token template requires operator click in portal. Cleared misleading CLOUDFLARE_API_TOKEN_PAGES Keychain slot; added Pages-token entry to scripts/ci/integration_env_registry.py so next session sees the missing slot + portal guidance immediately.	docs/PEARL_OPERATOR_PROXY_SPEC.md (in-envelope §5 scope sequencing, §7 read-only artifacts); skills/pearl-int/SKILL.md (SECURITY BOUNDARIES — Pearl_Int cannot click portal for operator); feedback_validation_before_scaling.md (PR #1111 already verified locally via vite preview + 4-locale Claude_Preview screenshots)	5	no	scripts/ci/integration_env_registry.py;artifacts/qa/pearl_int_health_check_2026-05-14.md;artifacts/coordination/operator_decisions_log.tsv	Pearl_Int
OPD-20260514-009	2026-05-14T04:55:00Z	agent/brand-wizard-composite-mode-20260514	GEMMA_BASE_URL Keychain population + Tailscale variant + .env.example scaffold	read_only_artifact	(a) Stored GEMMA_BASE_URL in macOS Keychain as service=phoenix-omega, account=GEMMA_BASE_URL (the loader's convention). Initial value was the documented LAN-only default http://192.168.1.101:11434/v1; overwrote to the Tailscale variant http://pearlstar.tail7fd910.ts.net:11434/v1 for parity with COMFYUI_URL/COSYVOICE_URL and to make it reachable from CI + dev machines via Tailscale. Verified HTTP 200 from /models — gemma3:27b + qwen2.5:14b available. check_integration_env.py now reports 0 REQUIRED missing (40/86 set). (b) Generated .env.example scaffold from the registry (258 lines, 86 vars, grouped by service, REQUIRED vs optional annotated, roundtrip-verified — every registry tuple appears exactly once in the template). Pearl_Int §3 follow-up complete.	docs/PEARL_OPERATOR_PROXY_SPEC.md (in-envelope §7 read-only artifacts); skills/pearl-int/SKILL.md (STEP 1 ENV FILE MANAGEMENT); scripts/ci/integration_env_registry.py canonical source	7	no	.env.example;scripts/ci/load_integration_env_from_keychain.py (consumer, unchanged);artifacts/qa/pearl_int_health_check_2026-05-14.md	Pearl_Int
