atom_path	classification	first_paragraph_excerpt	rewrite_priority
atoms/working_parents/depression/HOOK/CANONICAL.txt	SCENE_FIRST	You're in the minivan pickup line, hands on the wheel, face neutral for the teacher — the flatness stayed after postpartum and five years later you are still performing fine.	P1
atoms/working_parents/financial_anxiety/HOOK/CANONICAL.txt	SCENE_FIRST	You're at the table with the childcare invoice and the mortgage statement side by side, breath shallow — you work to pay for care so you can work and the math loops without landing.	P1
atoms/working_parents/financial_stress/HOOK/CANONICAL.txt	SCENE_FIRST	You're in the home office when the daycare charge posts, shoulders rising — childcare costs more than the house payment this month and your thumb hesitates before you click approve.	P1
atoms/working_parents/grief/HOOK/CANONICAL.txt	SCENE_FIRST	You're in the bathroom mirror at 6 AM, toothbrush in hand, eyes on your own face — you are grieving the person you were before kids and the person with time is not coming back.	P1
atoms/working_parents/imposter_syndrome/HOOK/CANONICAL.txt	SCENE_FIRST	You're at the school conference table, folder open, smile on, palms damp — you are managing kids and a job and still waiting to be told you are failing at both.	P1
atoms/working_parents/overthinking/HOOK/CANONICAL.txt	SCENE_FIRST	You're on the playground bench watching your child climb, phone buzzing with work, mind on the email — you are in two places and your jaw is tight in both.	P1
atoms/working_parents/self_worth/HOOK/CANONICAL.txt	SCENE_FIRST	You're at the pediatrician's office filling out the behavior form, pen moving, chest tight — good kid equals good parent equals your value as a human and the equation is lying to you.	P1
atoms/working_parents/sleep_anxiety/HOOK/CANONICAL.txt	SCENE_FIRST	You're on the couch at 9:45 PM when the house finally goes quiet, shoulders dropping then locking — your brain takes the first silence of the day as the opening shift for tomorrow's worry.	P1
atoms/working_parents/social_anxiety/HOOK/CANONICAL.txt	SCENE_FIRST	You're at the birthday party in the community room, plate in hand, eyes flicking to your phone — your attention is split across three places and the room feels like one more demand on your chest.	P1
atoms/working_parents/somatic_healing/HOOK/CANONICAL.txt	SCENE_FIRST	You're sitting on the edge of the bathtub after the kids are down, shoulders still at your ears, rolling your neck once — the tension has been there so long you forgot your body was making a choice.	P0
