atom_path	classification	first_paragraph_excerpt	rewrite_priority
atoms/gen_z_professionals/imposter_syndrome/HOOK/CANONICAL.txt	SCENE_FIRST	You're in the Zoom gallery on your third month, camera on, nodding while a director praises the deck — your throat is tight because part of you is still waiting for them to notice the file was a mista	P0
atoms/gen_z_professionals/overthinking/HOOK/CANONICAL.txt	SCENE_FIRST	You're on the subway at 8 AM, headphones in, jaw locked, scrolling workplace threads about layoffs and ethics — you keep running the same contradiction between what you know and what you participate i	P0
atoms/gen_z_professionals/self_worth/HOOK/CANONICAL.txt	SCENE_FIRST	Your performance review is in two hours and your chest is tight. Everything you did is about to be reduced to a score. Your value is sitting in a spreadsheet somewhere being decided by someone who doe	P2
atoms/gen_z_professionals/sleep_anxiety/HOOK/CANONICAL.txt	SCENE_FIRST	You killed the lights at eleven. The ceiling is still there at 2:14. You have run the math until the numbers go numb: if sleep came now, you would still land short. Your eyes stay shut. Your brain is 	P2
atoms/gen_z_professionals/social_anxiety/HOOK/CANONICAL.txt	SCENE_FIRST	You're filming a story update in your bathroom mirror at 9 PM, filter on, caption half-written about your career anxiety — your shoulders are raised and you already know posting it will not make the f	P0
atoms/gen_z_professionals/somatic_healing/HOOK/CANONICAL.txt	SCENE_FIRST	Amari is at her standing desk before standup, rolling her shoulders down — they rise again because twelve-hour sprints taught her body that soft is not safe.	P1
atoms/gen_z_student/anxiety/HOOK/CANONICAL.txt	SCENE_FIRST	Jordan is in her dorm at 11 PM when the syllabus drops, jaw locked before she reads a line — three papers, two exams, and a group project due the same week sit on the screen like a wall.	P1
atoms/gen_z_student/boundaries/HOOK/CANONICAL.txt	SCENE_FIRST	Her roommate's friends pile into the dorm at 11 p.m. on a Tuesday. Four bodies on the futon, someone's speaker blasting from the dresser. Her jaw clenches around the word she never says. She pulls her	P2
atoms/gen_z_student/burnout/HOOK/CANONICAL.txt	SCENE_FIRST	Jordan stares at the blinking cursor on a half-finished essay in week twelve, fingers locked above the keyboard, shoulders hunched — the screen blurs and her body will not type another sentence.	P1
atoms/gen_z_student/compassion_fatigue/HOOK/CANONICAL.txt	SCENE_FIRST	You're in bed at midnight when your friend's crisis text lights the screen, chest constricting — you want to show up and your body is already empty from being everyone's listener this week.	P1
atoms/gen_z_student/courage/HOOK/CANONICAL.txt	SCENE_FIRST	You're in lecture with the answer assembled three seconds ago, hand in your lap like a brick — the professor is still waiting and your throat will not open.	P1
atoms/gen_z_student/depression/HOOK/CANONICAL.txt	SCENE_FIRST	You're in bed at 8 AM when the alarm fires, eyelids pressed shut, limbs heavy in the mattress — you are not sleeping, you are refusing, and your body will not lift.	P1
atoms/gen_z_student/financial_anxiety/HOOK/CANONICAL.txt	SCENE_FIRST	Jordan is in the lecture hall when the bank notification slides down, stomach dropping before her eyes finish reading — the balance is lower than she told herself it would be on Monday.	P1
atoms/gen_z_student/financial_stress/HOOK/CANONICAL.txt	SCENE_FIRST	You're at the desk on Sunday night running the month's numbers, neck locked, hands cold on the keys — the column does not clear and your body already knows before the total finishes.	P1
atoms/gen_z_student/grief/HOOK/CANONICAL.txt	SCENE_FIRST	You walk into the lecture hall Monday morning. Third row, aisle seat — that was their spot. The chair sits empty. Your chest folds inward like wet cardboard. The professor starts talking about supply 	P2
atoms/gen_z_student/imposter_syndrome/HOOK/CANONICAL.txt	SCENE_FIRST	The acceptance letter arrived in March. By September, Kai sat in a 200-person lecture hall convinced the admissions office had confused his file with someone else's. His throat tightened every time th	P2
atoms/gen_z_student/overthinking/HOOK/CANONICAL.txt	SCENE_FIRST	"She typed ""sounds good"" and deleted it. Typed it again. Deleted it again. Her thumbs locked mid-air over the screen, pulse climbing into her jaw. Three dots appeared on his side. Vanished. The hallway"	P0
atoms/gen_z_student/self_worth/HOOK/CANONICAL.txt	SCENE_FIRST	You're in bed at 1 AM scrolling Instagram, thumb moving, chest sinking — a classmate's internship post lands and your body treats their win as evidence you are behind.	P1
atoms/gen_z_student/sleep_anxiety/HOOK/CANONICAL.txt	SCENE_FIRST	Your phone screen burns white against the dark ceiling at 2:47 AM. Your jaw locks tight. Your thumbs scroll through nothing — TikTok, Instagram, TikTok again — because stopping means facing the silenc	P2
atoms/gen_z_student/social_anxiety/HOOK/CANONICAL.txt	SCENE_FIRST	You're in the dorm hallway outside the dining hall, stomach dropping three floors — noise pours through the open doors and you scan for one familiar face before you step in.	P1
atoms/gen_z_student/somatic_healing/HOOK/CANONICAL.txt	SCENE_FIRST	Your shoulders touched your ears during freshman orientation. They never came back down. Four semesters later, your neck has forgotten what neutral feels like. The trapezius muscles run a permanent sh	P2
atoms/healthcare_rns/anxiety/HOOK/CANONICAL.txt	SCENE_FIRST	Your chest tightens as you review the medication times. Three minutes between doses instead of five, and the physician signed off without reading the note. Your jaw clenches while you stare at the cha	P2
atoms/healthcare_rns/boundaries/HOOK/CANONICAL.txt	SCENE_FIRST	You're at the nurses' station when the charge nurse asks you to stay, shoulders dropping — it is the third time this week and your mouth is already forming yes before you decide.	P1
atoms/healthcare_rns/burnout/HOOK/CANONICAL.txt	SCENE_FIRST	Maria is in the break room at 3 AM, sandwich untouched, eyes on the clock — she has four hours left on the stretch and her chest feels like she is watching herself from the hallway.	P1
atoms/healthcare_rns/compassion_fatigue/HOOK/CANONICAL.txt	SCENE_FIRST	You're in Room 412 at 2 AM, gloved hands steady on the rails, voice soft for the crying patient — your chest stays perfectly flat while the right words leave your mouth.	P0
atoms/healthcare_rns/courage/HOOK/CANONICAL.txt	SCENE_FIRST	You're outside the attending's workstation, chart in hand, throat tight — you are about to say the labs do not match the note and you already know it will cost you something.	P1
atoms/healthcare_rns/depression/HOOK/CANONICAL.txt	SCENE_FIRST	You're in the driver's seat of your car at 7 AM after night shift, hands on the wheel, world gray through the windshield — eight hours of sleep will not touch what sits behind your ribs.	P0
atoms/healthcare_rns/financial_anxiety/HOOK/CANONICAL.txt	SCENE_FIRST	You're at the kitchen table in scrubs still damp from shift, pay stub and rent bill spread out — your fingers freeze on the ratio that has not moved since you became an RN.	P1
atoms/healthcare_rns/financial_stress/HOOK/CANONICAL.txt	SCENE_FIRST	You're at the kitchen table in scrubs still damp from shift, calculator and pay stub spread out — your chest tightens on the rent-to-salary ratio that has not moved since you became an RN.	P0
atoms/healthcare_rns/grief/HOOK/CANONICAL.txt	SCENE_FIRST	You're outside Room 412 an hour after the code, gloved hands already changed, shoulders moving toward the next assignment — the patient you held is gone and there is no break time to name it.	P1
atoms/healthcare_rns/imposter_syndrome/HOOK/CANONICAL.txt	SCENE_FIRST	You're in the physicians' lounge doorway with coffee, badge visible, palms damp — you have caught deteriorations early and still do not feel qualified to be in the room when they round.	P1
atoms/healthcare_rns/overthinking/HOOK/CANONICAL.txt	SCENE_FIRST	You're in your car after night shift, hands on the wheel, replaying the assessment you charted correctly — you can name your own activation and your jaw is still locked on the one detail.	P1
atoms/healthcare_rns/self_worth/HOOK/CANONICAL.txt	SCENE_FIRST	You're at the nurses' station after rounds, chart open, chest tight — you stabilized the patient and watched the physician take credit without looking at your name.	P1
atoms/healthcare_rns/sleep_anxiety/HOOK/CANONICAL.txt	SCENE_FIRST	You got home from the twelve-hour shift and the adrenaline is still in your hands. You washed your hands four times but you can still feel the hospital on your skin. Your brain is still in clinical mo	P2
atoms/healthcare_rns/social_anxiety/HOOK/CANONICAL.txt	SCENE_FIRST	You're in the staff break room at lunch, tray in hand, shoulders braced by the door — you can run a code calmly and small talk makes your throat close like a false alarm.	P1
atoms/healthcare_rns/somatic_healing/HOOK/CANONICAL.txt	SCENE_FIRST	Your shoulders have been held at your ears since the start of shift work and you've stopped noticing.	P2
atoms/midlife_women/anxiety/HOOK/CANONICAL.txt	SCENE_FIRST	Diane woke at 3:14am with her heart already ahead of her, cataloging everything that could go wrong before she'd opened her eyes.	P2
atoms/midlife_women/boundaries/HOOK/CANONICAL.txt	SCENE_FIRST	Diane is in the driver's seat at 7:52 AM, phone buzzing with her mother's eighth call this week, thumb hovering over answer — she has a 9 AM meeting and her shoulders are already braced for forty more	P0
atoms/midlife_women/burnout/HOOK/CANONICAL.txt	SCENE_FIRST	Diane is at the kitchen table on Sunday night, planner open, pen still in her hand without moving — she scheduled her mother's cardiologist, her son's IEP, her mammogram, and the quarterly review in o	P0
atoms/midlife_women/compassion_fatigue/HOOK/CANONICAL.txt	SCENE_FIRST	Diane is in her car in the grocery lot at 6 PM, phone showing three missed calls — her mother, her daughter, and a colleague all needed her today and her chest has no room left.	P1
atoms/midlife_women/courage/HOOK/CANONICAL.txt	SCENE_FIRST	Diane is at the kitchen table at 9 PM, hands flat on the placemat, voice steady — at forty-nine she is saying the thing in her marriage she has not said for eleven years.	P1
atoms/midlife_women/depression/HOOK/CANONICAL.txt	SCENE_FIRST	Diane is in the shower at 10 PM, water on her shoulders, face neutral — she was fine at dinner and fine in the meeting and alone her chest feels like a room with the lights off.	P1
atoms/midlife_women/financial_anxiety/HOOK/CANONICAL.txt	SCENE_FIRST	Diane is at the dining table with the retirement spreadsheet open, reading glasses on, fingers pressed to her temples — the gap between where she is and where she should be is the same as last month.	P1
atoms/midlife_women/financial_stress/HOOK/CANONICAL.txt	SCENE_FIRST	Diane is in the memory-care billing portal at 11 PM, screen glowing, shoulders high — $6,400 a month against an $87,000 salary she is doing in her head again.	P1
atoms/midlife_women/grief/HOOK/CANONICAL.txt	SCENE_FIRST	Diane is in her mother's kitchen on Tuesday, hands on the counter, breath shallow — her mother looked at her and did not know her name, and she drove home and cooked dinner anyway.	P1
atoms/midlife_women/imposter_syndrome/HOOK/CANONICAL.txt	SCENE_FIRST	She has twenty-two years of experience and a graduate degree and she still lowers her voice slightly when she speaks in the Monday meeting where all the men are older and louder.	P2
atoms/midlife_women/overthinking/HOOK/CANONICAL.txt	SCENE_FIRST	Diane is awake at 4 AM in bed, eyes open to the ceiling, fingers worrying the edge of the blanket — she has been planning contingencies so long she cannot tell strategy from anxiety hunting for a cont	P0
atoms/midlife_women/self_worth/HOOK/CANONICAL.txt	SCENE_FIRST	Diane is in her therapist's office, notebook on her lap, eyes down — she can list what she did for everyone else this year and her mouth goes quiet when asked what she did for herself.	P1
atoms/midlife_women/sleep_anxiety/HOOK/CANONICAL.txt	SCENE_FIRST	She wakes at 3:17am and the night sweats have already passed and now it's the thoughts, arriving with the same precision they showed up the night before and the night before that.	P2
atoms/midlife_women/social_anxiety/HOOK/CANONICAL.txt	SCENE_FIRST	Diane sits in her car in the party parking lot for ten minutes, hands on the wheel, engine off — she used to work any room and now her throat closes before she opens the door.	P0
atoms/midlife_women/somatic_healing/HOOK/CANONICAL.txt	SCENE_FIRST	Diane is at the yoga mat in the bedroom at 6 AM, rolling her shoulders down slowly — they have been at her ears so long she forgot her body was making a choice.	P1
atoms/millennial_women_professionals/anxiety/HOOK/CANONICAL.txt	SCENE_FIRST	Your chest tightens mid-Slack message. You're not panicking—you're managing the perception that you could panic. The gap between the polished Zoom square and your actual nervous system just got wider.	P2
atoms/millennial_women_professionals/boundaries/HOOK/CANONICAL.txt	SCENE_FIRST	You're in your manager's doorway at 4 PM, notebook against your chest, throat tightening as you say yes to the weekend ask — you already know the cost before the words finish leaving your mouth.	P0
atoms/millennial_women_professionals/burnout/HOOK/CANONICAL.txt	SCENE_FIRST	You're at the dining table at 12:18 AM, laptop open, shoulders hunched toward the screen, typing another reply because nobody else will — you have told yourself this is what reliable looks like.	P0
atoms/millennial_women_professionals/compassion_fatigue/HOOK/CANONICAL.txt	SCENE_FIRST	You're in the team kitchen at 4 PM, colleague leaning on the counter, your chest receiving again — you are everyone's listening place and nothing is coming back into your ribs today.	P1
atoms/millennial_women_professionals/courage/HOOK/CANONICAL.txt	SCENE_FIRST	You spoke in the meeting and immediately regretted it. Your jaw clenched the moment you stopped talking. The second-guessing started before the room moved on.	P2
atoms/millennial_women_professionals/depression/HOOK/CANONICAL.txt	SCENE_FIRST	You're at your desk between back-to-back meetings, calendar green, body flat — your life looks fine on the screen and inside is the gray nobody in the hallway can see.	P1
atoms/millennial_women_professionals/financial_anxiety/HOOK/CANONICAL.txt	SCENE_FIRST	You're on the couch at 10 PM with the banking app and the mental spreadsheet both running — rent, savings target, and the raise conversation you did not have sit in your stomach like math that never c	P1
atoms/millennial_women_professionals/financial_stress/HOOK/CANONICAL.txt	SCENE_FIRST	You're at the kitchen table at 11 PM, student loan portal open, hands trying to sketch a future — at thirty-five the numbers still will not land and your chest tightens on the decade you cannot see.	P1
atoms/millennial_women_professionals/grief/HOOK/CANONICAL.txt	SCENE_FIRST	You're in the Uber after leaving the clinic, hands in your lap, chest aching — you made the right choice and your body is still grieving the door that locked behind you.	P1
atoms/millennial_women_professionals/imposter_syndrome/HOOK/CANONICAL.txt	SCENE_FIRST	You're in the team Slack thread after the launch shipped, cursor blinking in the congratulations channel — you accomplished something real and your stomach is busy finding the sentence where luck expl	P0
atoms/millennial_women_professionals/overthinking/HOOK/CANONICAL.txt	SCENE_FIRST	You're awake at 2:06 AM in bed, eyes shut, jaw clenched, replaying the 47 seconds in yesterday's meeting — maybe too direct, maybe not direct enough — in full detail on a loop your body cannot stop.	P0
atoms/millennial_women_professionals/self_worth/HOOK/CANONICAL.txt	SCENE_FIRST	You're at your desk at 3 PM, hands frozen above the keyboard, panic rising because output stopped — you have built a life where you only feel real when something measurable is leaving your fingers.	P0
atoms/millennial_women_professionals/sleep_anxiety/HOOK/CANONICAL.txt	SCENE_FIRST	You're lying in bed at 2 AM, body heavy, eyes open, thumbs pressed into the sheet while tomorrow's meeting runs in your head — you know rehearsing worst cases is not preparation and you do it anyway.	P0
atoms/millennial_women_professionals/social_anxiety/HOOK/CANONICAL.txt	SCENE_FIRST	You're standing outside the conference room glass at 8:58 AM, badge in hand, chest tight — your body is already drafting every way you might say the wrong thing before you touch the door.	P0
atoms/millennial_women_professionals/somatic_healing/HOOK/CANONICAL.txt	SCENE_FIRST	You're at your desk before the 9 AM sync, rolling your shoulders down once — they climb back because reliable has meant braced for so long your body forgot another shape.	P1
atoms/nyc_executives/anxiety/HOOK/CANONICAL.txt	SCENE_FIRST	Catherine is in the back seat of a town car at 11 PM, deal closed, phone dark in her lap — her chest is still braced as if the term sheet could still fall apart.	P2
atoms/nyc_executives/boundaries/HOOK/CANONICAL.txt	SCENE_FIRST	The client email lands at 11:47pm on Friday. Your chest knows you're already opening it.	P2
atoms/nyc_executives/burnout/HOOK/CANONICAL.txt	SCENE_FIRST	Catherine is alone at the fund-close dinner table on Friday night, champagne untouched, shoulders flat — her body did not register celebration, only the brief silence before the next mandate loads.	P2
atoms/nyc_executives/compassion_fatigue/HOOK/CANONICAL.txt	SCENE_FIRST	Marcus is in his corner office at 6 PM, direct report crying on the couch across from him — his chest tightens because he is burned out too and still has to hold the room.	P2
atoms/nyc_executives/courage/HOOK/CANONICAL.txt	SCENE_FIRST	Catherine is at the head of the board table, deal deck open, jaw set — she knows the numbers are wrong, the room disagrees, and her chest burns with the knowing she is about to voice.	P2
atoms/nyc_executives/depression/HOOK/CANONICAL.txt	SCENE_FIRST	Marcus steps out of the town car at the gala, biggest deal of his career sealed hours ago, face flat in the camera flash — he arrived and felt nothing he was supposed to feel.	P2
atoms/nyc_executives/financial_anxiety/HOOK/CANONICAL.txt	SCENE_FIRST	The equity vested. Her net worth crossed a number she'd named as safe ten years ago. Her chest still tightens on Monday mornings when the market opens.	P2
atoms/nyc_executives/financial_stress/HOOK/CANONICAL.txt	SCENE_FIRST	Catherine is in the elevator watching the market ticker on her phone, portfolio down two percent, chest contracted with it before the doors open on forty-three.	P2
atoms/nyc_executives/grief/HOOK/CANONICAL.txt	SCENE_FIRST	Marcus is at his father's hospital bedside on Tuesday night, hand on the rail, Thursday's earnings call already on his watch — his chest knows which calendar entry the firm will treat as real.	P2
atoms/nyc_executives/imposter_syndrome/HOOK/CANONICAL.txt	SCENE_FIRST	Catherine is at the board table under the plaque that says first woman to chair this committee, pen steady on her notes — her body spends every session scanning for the moment they decide it was a mis	P2
atoms/nyc_executives/overthinking/HOOK/CANONICAL.txt	SCENE_FIRST	Catherine is in her car parked outside the office an hour after the meeting ended, hands on the wheel, replaying the VP's silence at slide four — a new interpretation every thirty seconds.	P2
atoms/nyc_executives/self_worth/HOOK/CANONICAL.txt	SCENE_FIRST	Marcus is loosening his tie in an empty corner office at 8 PM, title on the door, chest hollow — the role used to feel like it meant something and now he knows it is a costume.	P2
atoms/nyc_executives/sleep_anxiety/HOOK/CANONICAL.txt	SCENE_FIRST	Marcus is awake at 3 AM in the penthouse bedroom, eyes open to the ceiling, term sheet pages running in his head — not worry exactly, but a body that has not been told the deal is over.	P2
atoms/nyc_executives/social_anxiety/HOOK/CANONICAL.txt	SCENE_FIRST	The client dinner is part of the job. She closes these rooms. Her chest runs threat calculations from the car to the door that have nothing to do with the business.	P2
atoms/nyc_executives/somatic_healing/HOOK/CANONICAL.txt	SCENE_FIRST	Catherine is on the massage table on Saturday afternoon, therapist's hands on her lower back — by Tuesday morning commute her body has reloaded the tension as if the appointment never happened.	P2
atoms/tech_finance_burnout/anxiety/HOOK/CANONICAL.txt	SCENE_FIRST	Your chest tightens before you even see the Slack message. The algorithm in your head has already calculated seven failure scenarios by the time the page fires, each one a small death of your quarterl	P2
atoms/tech_finance_burnout/boundaries/HOOK/CANONICAL.txt	SCENE_FIRST	The Slack notification lands at 11pm on Friday. Your shoulders tense because you know the answer is yes before you even read the message, and saying no would require a conversation you're not availabl	P2
atoms/tech_finance_burnout/burnout/HOOK/CANONICAL.txt	SCENE_FIRST	You're at the standing desk at 11 PM, three monitors lit, shoulders hunched toward the incident channel — you can diagram exactly how the burnout is happening and your body is still inside the diagram	P1
atoms/tech_finance_burnout/compassion_fatigue/HOOK/CANONICAL.txt	SCENE_FIRST	You're in the mentorship pod at 6 PM, junior engineer crying, your shoulders exhausted — you are the senior person everyone comes to while you are running on fumes yourself.	P1
atoms/tech_finance_burnout/courage/HOOK/CANONICAL.txt	SCENE_FIRST	Your jaw clenches before you speak up in the meeting. In a culture that rewards certainty, doubt is heresy, and you're about to commit heresy in front of the people who determine your trajectory. The 	P2
atoms/tech_finance_burnout/depression/HOOK/CANONICAL.txt	SCENE_FIRST	You're in bed at 2 AM staring at the ceiling, smartwatch band tight on your wrist — your chest stopped rising somewhere around November and flatness replaced the sprint high.	P1
atoms/tech_finance_burnout/financial_anxiety/HOOK/CANONICAL.txt	SCENE_FIRST	You're at the kitchen island with the model open, equity refresh on screen, fingers still — you can price the market better than your fear and the fear keeps escaping the spreadsheet.	P1
atoms/tech_finance_burnout/financial_stress/HOOK/CANONICAL.txt	SCENE_FIRST	You're in the garage looking at the car payment notice, jaw tight — the golden handcuffs fit and the lifestyle line on the budget is the lock you helped build.	P1
atoms/tech_finance_burnout/grief/HOOK/CANONICAL.txt	SCENE_FIRST	You're packing a box in the empty startup office at 7 PM, logo sticker peeling in your hand — the company failed and your chest is holding a grief that does not have a clean name.	P1
atoms/tech_finance_burnout/imposter_syndrome/HOOK/CANONICAL.txt	SCENE_FIRST	You're in the board deck review room, metrics proving the quarter, palms on the table — you still cannot make your body believe the numbers belong to you.	P1
atoms/tech_finance_burnout/overthinking/HOOK/CANONICAL.txt	SCENE_FIRST	You're at the desk at 1 AM with the debugger open on your own thoughts, jaw locked — there is a stack trace of anxiety running and you cannot find the line to break.	P1
atoms/tech_finance_burnout/self_worth/HOOK/CANONICAL.txt	SCENE_FIRST	You're at the keyboard when output stops, hands hovering, chest tight — worth equals output and the equation has been running so long you do not know who you are between commits.	P1
atoms/tech_finance_burnout/sleep_anxiety/HOOK/CANONICAL.txt	SCENE_FIRST	You're in bed at 1:47 AM, smartwatch glowing on the nightstand, lying on your back with eyes open — you've diagrammed the sleep failure seventeen times and understanding has not turned the protocol of	P0
atoms/tech_finance_burnout/social_anxiety/HOOK/CANONICAL.txt	SCENE_FIRST	You're outside the all-hands room at 8:58 AM, badge in hand, shoulders braced — you can model the limbic false alarm and your throat still will not open the door.	P1
atoms/tech_finance_burnout/somatic_healing/HOOK/CANONICAL.txt	SCENE_FIRST	You're at your standing desk on Tuesday morning, shoulders pinned near your ears, trying to roll them down — they rise again before the standup starts because straight has started to feel wrong.	P0
atoms/working_parents/anxiety/HOOK/CANONICAL.txt	SCENE_FIRST	Your shoulders climb toward your ears before dawn. The catastrophizing arrives before your feet hit the floor—a sick spiral of worst-case scenarios about school, illness, car accidents, the climate. Y	P2
atoms/working_parents/boundaries/HOOK/CANONICAL.txt	SCENE_FIRST	You're on the nursery floor at 8:30 PM, toddler climbing your back, work phone buzzing in your pocket — you answer before you decide because saying no does not feel available tonight.	P0
atoms/working_parents/burnout/HOOK/CANONICAL.txt	SCENE_FIRST	You're at the kitchen sink at 9:30 PM, dishes in your hands, shoulders sagging — the kids are down, the laptop is closed, and your body is still running the day it cannot finish.	P1
atoms/working_parents/compassion_fatigue/HOOK/CANONICAL.txt	SCENE_FIRST	You're loading the dishwasher at 9 PM, back aching, still wearing the smile you gave your child at homework time — you gave to your partner and your mother and your boss today and your chest is empty.	P0
atoms/working_parents/courage/HOOK/CANONICAL.txt	SCENE_FIRST	You're in the hallway at bedtime, child screaming on the floor, feet planted, jaw set — your body wants to rescue and you are standing in the discomfort because you know what rescue costs.	P1
