book_id,title,subtitle,short_hook,author,installment,topic,engine,persona,cluster
way_stream_sanctuary__default_teacher__corporate_managers__anxiety__comparison,Anxiety Relief: The Comparison Habit,When Other People's Success Feels Like Your Failure,Just You,Mara Okonkwo,1,anxiety,comparison,corporate_managers,
way_stream_sanctuary__default_teacher__corporate_managers__anxiety__comparison__1hr,Anxiety Relief: Beyond the Highlight Reel,Beyond the Highlight Reel,,Mara Okonkwo,1,anxiety,comparison,corporate_managers,Calm the Alarm
way_stream_sanctuary__default_teacher__corporate_managers__anxiety__false_alarm,Anxiety Relief: Misreading the Danger Signal,A Real Talk Guide to Anxiety for Corporate Managers,Ease Up,Mara Okonkwo,2,anxiety,false_alarm,corporate_managers,
way_stream_sanctuary__default_teacher__corporate_managers__anxiety__false_alarm__1hr,Anxiety Relief: The False Alarm Response,When Fear Lies to You,,Mara Okonkwo,2,anxiety,false_alarm,corporate_managers,Calm the Alarm
way_stream_sanctuary__default_teacher__corporate_managers__anxiety__grief,Anxiety Relief: After the Loss,A Gentle Guide to Moving Through Grief Without Forcing Yourself to 'Get Over It',Let It Land,Mara Okonkwo,3,anxiety,grief,corporate_managers,
way_stream_sanctuary__default_teacher__corporate_managers__anxiety__grief__1hr,Anxiety Relief: The Weight You Carry,A Field Guide for Corporate Managers Navigating Anxiety,Steady Now,Mara Okonkwo,3,anxiety,grief,corporate_managers,Calm the Alarm
way_stream_sanctuary__default_teacher__corporate_managers__anxiety__overwhelm,Anxiety Relief: When Everything Is Too Much,Drowning in Demands,,Mara Okonkwo,4,anxiety,overwhelm,corporate_managers,
way_stream_sanctuary__default_teacher__corporate_managers__anxiety__overwhelm__1hr,The Alarm Is Lying: When Everything Is Too Much,How Corporate Managers Are Rewriting the Rules of Anxiety,Steady On,Mara Okonkwo,4,anxiety,overwhelm,corporate_managers,Calm the Alarm
way_stream_sanctuary__default_teacher__corporate_managers__anxiety__shame,Anxiety Relief: Carrying What You Can't Say,Understanding How Shame Works in Your Body and Mind — and How to Release It,Set It Down,Mara Okonkwo,5,anxiety,shame,corporate_managers,
way_stream_sanctuary__default_teacher__corporate_managers__anxiety__shame__1hr,Anxiety Relief: The Shame Response,The Shame Response,,Mara Okonkwo,5,anxiety,shame,corporate_managers,Calm the Alarm
way_stream_sanctuary__default_teacher__corporate_managers__anxiety__spiral,Anxiety Relief: Breaking the Thought Loop,The Rumination Trap,Stop Looping,Mara Okonkwo,6,anxiety,spiral,corporate_managers,
way_stream_sanctuary__default_teacher__corporate_managers__anxiety__spiral__1hr,The Alarm Is Lying: Breaking the Thought Loop,The Overthinking Spiral,Quiet Mind,Mara Okonkwo,6,anxiety,spiral,corporate_managers,Calm the Alarm
way_stream_sanctuary__default_teacher__corporate_managers__anxiety__watcher,Anxiety Relief: The Observer's Mind,The Witnessing Practice,Just Watch,Mara Okonkwo,7,anxiety,watcher,corporate_managers,
way_stream_sanctuary__default_teacher__corporate_managers__anxiety__watcher__1hr,The Alarm Is Lying: The Observer's Mind,Watching Your Thoughts Without Drowning,Let It Pass,Mara Okonkwo,7,anxiety,watcher,corporate_managers,Calm the Alarm
way_stream_sanctuary__default_teacher__corporate_managers__boundaries__comparison,Setting Boundaries: Beyond the Highlight Reel,How Corporate Managers Are Rewriting the Rules of Boundaries,Your Limits,Theo Castellan,1,boundaries,comparison,corporate_managers,Worth & Limits
way_stream_sanctuary__default_teacher__corporate_managers__boundaries__comparison__1hr,The Line You Never Drew: Beyond the Highlight Reel,How to Stop Measuring Your Worth Against Others and Build Real Confidence,Stop Measuring,Theo Castellan,1,boundaries,comparison,corporate_managers,Worth & Limits
way_stream_sanctuary__default_teacher__corporate_managers__boundaries__false_alarm,Setting Boundaries: Misreading the Danger Signal,How to Recognize When Anxiety Is a False Alarm — and What to Do Instead,Not Danger,Theo Castellan,2,boundaries,false_alarm,corporate_managers,Worth & Limits
way_stream_sanctuary__default_teacher__corporate_managers__boundaries__false_alarm__1hr,The Line You Never Drew: Misreading the Danger Signal,A Real Talk Guide to Boundaries for Corporate Managers,Say No,Theo Castellan,2,boundaries,false_alarm,corporate_managers,Worth & Limits
way_stream_sanctuary__default_teacher__corporate_managers__boundaries__shame,Setting Boundaries: When You Feel Fundamentally Wrong,A Field Guide for Corporate Managers Navigating Boundaries,Hold The Line,Theo Castellan,3,boundaries,shame,corporate_managers,Worth & Limits
way_stream_sanctuary__default_teacher__corporate_managers__boundaries__shame__1hr,The Line You Never Drew: When You Feel Fundamentally Wrong,When You Feel Fundamentally Wrong,You Are Okay,Theo Castellan,3,boundaries,shame,corporate_managers,Worth & Limits
way_stream_sanctuary__default_teacher__corporate_managers__burnout__grief,Burnout Recovery: Living with What You've Lost,A Real Talk Guide to Burnout for Corporate Managers,Refill You,Theo Castellan,1,burnout,grief,corporate_managers,Refill the Empty Well
way_stream_sanctuary__default_teacher__corporate_managers__burnout__grief__1hr,Burnout Recovery: The Weight You Carry,A Field Guide for Corporate Managers Navigating Burnout,Rest Easy,Theo Castellan,1,burnout,grief,corporate_managers,Steady Ground
way_stream_sanctuary__default_teacher__corporate_managers__burnout__overwhelm,Burnout Recovery: When Everything Is Too Much,"Too Many Things, Not Enough You",One Thing,Theo Castellan,2,burnout,overwhelm,corporate_managers,Refill the Empty Well
way_stream_sanctuary__default_teacher__corporate_managers__burnout__overwhelm__1hr,Burnout Recovery: Drowning in Demands,The Overwhelm Response,Set It Down,Theo Castellan,2,burnout,overwhelm,corporate_managers,Steady Ground
way_stream_sanctuary__default_teacher__corporate_managers__burnout__watcher,Burnout Recovery: The Witnessing Practice,How Corporate Managers Are Rewriting the Rules of Burnout,Make Space,Theo Castellan,3,burnout,watcher,corporate_managers,Refill the Empty Well
way_stream_sanctuary__default_teacher__corporate_managers__burnout__watcher__1hr,Burnout Recovery: The Observer's Mind,The Space Between You and Your Anxiety,Step Back,Theo Castellan,3,burnout,watcher,corporate_managers,Steady Ground
way_stream_sanctuary__default_teacher__corporate_managers__compassion_fatigue__grief,Compassion Fatigue: Living with What You've Lost,A Real Talk Guide to Compassion Fatigue for Corporate Managers,Refill You,Theo Castellan,1,compassion_fatigue,grief,corporate_managers,Refill the Empty Well
way_stream_sanctuary__default_teacher__corporate_managers__compassion_fatigue__overwhelm,Compassion Fatigue: The Shutdown Point,A Field Guide for Corporate Managers Navigating Compassion Fatigue,One Thing,Theo Castellan,2,compassion_fatigue,overwhelm,corporate_managers,Refill the Empty Well
way_stream_sanctuary__default_teacher__corporate_managers__compassion_fatigue__watcher,Compassion Fatigue: The Space Between You and Your Anxiety,How Corporate Managers Are Rewriting the Rules of Compassion Fatigue,Care Lasts,Theo Castellan,3,compassion_fatigue,watcher,corporate_managers,Refill the Empty Well
way_stream_sanctuary__default_teacher__corporate_managers__courage__false_alarm,Building Courage: Misreading the Danger Signal,How Corporate Managers Are Rewriting the Rules of Courage,Feel Fear,Mara Okonkwo,1,courage,false_alarm,corporate_managers,Brave in the World
way_stream_sanctuary__default_teacher__corporate_managers__courage__false_alarm__1hr,Building Courage: The False Alarm Response,A Field Guide for Corporate Managers Navigating Courage,Be Brave,Mara Okonkwo,1,courage,false_alarm,corporate_managers,Brave in the World
way_stream_sanctuary__default_teacher__corporate_managers__courage__shame,Building Courage: The Shame Response,A Real Talk Guide to Courage for Corporate Managers,Begin Again,Mara Okonkwo,2,courage,shame,corporate_managers,Brave in the World
way_stream_sanctuary__default_teacher__corporate_managers__courage__shame__1hr,Building Courage: Carrying What You Can't Say,Carrying What You Can't Say,,Mara Okonkwo,2,courage,shame,corporate_managers,Brave in the World
way_stream_sanctuary__default_teacher__corporate_managers__courage__spiral,Building Courage: Escaping the Mental Loop,When One Thought Becomes a Thousand,Stop Looping,Mara Okonkwo,3,courage,spiral,corporate_managers,Brave in the World
way_stream_sanctuary__default_teacher__corporate_managers__courage__spiral__1hr,Building Courage: The Overthinking Spiral,Escaping the Mental Loop,,Mara Okonkwo,3,courage,spiral,corporate_managers,Brave in the World
way_stream_sanctuary__default_teacher__corporate_managers__depression__grief,Overcoming Depression: Living with What You've Lost,The Grief That Doesn't Leave,Let It Land,Theo Castellan,1,depression,grief,corporate_managers,Through the Low Places
way_stream_sanctuary__default_teacher__corporate_managers__depression__grief__1hr,Overcoming Depression: The Weight You Carry,A Real Talk Guide to Depression for Corporate Managers,Light Ahead,Theo Castellan,1,depression,grief,corporate_managers,Through the Low Places
way_stream_sanctuary__default_teacher__corporate_managers__depression__overwhelm,Overcoming Depression: When Everything Is Too Much,A Field Guide for Corporate Managers Navigating Depression,One Step,Theo Castellan,2,depression,overwhelm,corporate_managers,Through the Low Places
way_stream_sanctuary__default_teacher__corporate_managers__depression__overwhelm__1hr,The Weight Without a Name: When Everything Is Too Much,How Corporate Managers Are Rewriting the Rules of Depression,Lighter Days,Theo Castellan,2,depression,overwhelm,corporate_managers,Through the Low Places
way_stream_sanctuary__default_teacher__corporate_managers__depression__watcher,Overcoming Depression: The Observer's Mind,Stepping Back from the Storm,Step Back,Theo Castellan,3,depression,watcher,corporate_managers,Through the Low Places
way_stream_sanctuary__default_teacher__corporate_managers__depression__watcher__1hr,Overcoming Depression: The Witnessing Practice,How to Create Distance from Anxious Thoughts and Find Clarity,Clear View,Theo Castellan,3,depression,watcher,corporate_managers,Through the Low Places
way_stream_sanctuary__default_teacher__corporate_managers__financial_anxiety__overwhelm,Financial Anxiety: When Everything Is Too Much,A Real Talk Guide to Financial Anxiety for Corporate Managers,Steady Money,Theo Castellan,1,financial_anxiety,overwhelm,corporate_managers,Money Without Panic
way_stream_sanctuary__default_teacher__corporate_managers__financial_anxiety__overwhelm__1hr,The Number in Your Head: When Everything Is Too Much,A Field Guide for Corporate Managers Navigating Financial Anxiety,Steady Cash,Theo Castellan,1,financial_anxiety,overwhelm,corporate_managers,Steady Ground
way_stream_sanctuary__default_teacher__corporate_managers__financial_anxiety__shame,Financial Anxiety: When You Feel Fundamentally Wrong,How Corporate Managers Are Rewriting the Rules of Financial Anxiety,Set It Down,Theo Castellan,2,financial_anxiety,shame,corporate_managers,Money Without Panic
way_stream_sanctuary__default_teacher__corporate_managers__financial_anxiety__shame__1hr,Financial Anxiety: What Shame Does to You,What Shame Does to You,You Are Okay,Theo Castellan,2,financial_anxiety,shame,corporate_managers,Steady Ground
way_stream_sanctuary__default_teacher__corporate_managers__financial_anxiety__spiral,Financial Anxiety: When One Thought Becomes a Thousand,A Step-by-Step Method to Interrupt Spiraling Thoughts Before They Take Over,Stop Looping,Theo Castellan,3,financial_anxiety,spiral,corporate_managers,Money Without Panic
way_stream_sanctuary__default_teacher__corporate_managers__financial_anxiety__spiral__1hr,Financial Anxiety: Breaking the Thought Loop,Escaping the Mental Loop — Financial Anxiety for Corporate Managers (Breaking the Thought Loop),Step Out,Theo Castellan,3,financial_anxiety,spiral,corporate_managers,Steady Ground
way_stream_sanctuary__default_teacher__corporate_managers__financial_stress__overwhelm,The Paycheck Pressure: The Shutdown Point,A Field Guide for Corporate Managers Navigating Financial Stress,Steady Money,Theo Castellan,1,financial_stress,overwhelm,corporate_managers,Money Without Panic
way_stream_sanctuary__default_teacher__corporate_managers__financial_stress__shame,The Paycheck Pressure: The Shame Response,A Real Talk Guide to Financial Stress for Corporate Managers,You Are Okay,Theo Castellan,2,financial_stress,shame,corporate_managers,Money Without Panic
way_stream_sanctuary__default_teacher__corporate_managers__financial_stress__spiral,The Paycheck Pressure: The Overthinking Spiral,How Corporate Managers Are Rewriting the Rules of Financial Stress,Steady Cash,Theo Castellan,3,financial_stress,spiral,corporate_managers,Money Without Panic
way_stream_sanctuary__default_teacher__corporate_managers__grief__grief,Grief: The Weight You Carry,How Corporate Managers Are Rewriting the Rules of Grief,Let It Land,Theo Castellan,1,grief,grief,corporate_managers,Through the Low Places
way_stream_sanctuary__default_teacher__corporate_managers__grief__grief__1hr,Grief: When Loss Reshapes Everything,A Real Talk Guide to Grief for Corporate Managers,Hold It Soft,Theo Castellan,1,grief,grief,corporate_managers,Through the Low Places
way_stream_sanctuary__default_teacher__corporate_managers__grief__watcher,Grief: The Space Between You and Your Anxiety,A Field Guide for Corporate Managers Navigating Grief,Witness It,Theo Castellan,2,grief,watcher,corporate_managers,Through the Low Places
way_stream_sanctuary__default_teacher__corporate_managers__grief__watcher__1hr,Grief: The Observer's Mind,The Witnessing Practice — Grief for Corporate Managers (The Observer's Mind),Just Watch,Theo Castellan,2,grief,watcher,corporate_managers,Through the Low Places
way_stream_sanctuary__default_teacher__corporate_managers__imposter_syndrome__comparison,Imposter Syndrome: The Comparison Trap,Measuring Yourself Against Everyone,You Belong,Theo Castellan,1,imposter_syndrome,comparison,corporate_managers,Worth & Limits
way_stream_sanctuary__default_teacher__corporate_managers__imposter_syndrome__shame,Imposter Syndrome: Carrying What You Can't Say,A Real Talk Guide to Imposter Syndrome for Corporate Managers,You Belong,Theo Castellan,2,imposter_syndrome,shame,corporate_managers,Worth & Limits
way_stream_sanctuary__default_teacher__corporate_managers__overthinking__false_alarm,Stop Overthinking: The False Alarm Response,How Corporate Managers Are Rewriting the Rules of Overthinking,Quiet Mind,Mara Okonkwo,1,overthinking,false_alarm,corporate_managers,Quiet the Restless Mind
way_stream_sanctuary__default_teacher__corporate_managers__overthinking__false_alarm__1hr,The Thought That Won't Leave: The False Alarm Response,A Real Talk Guide to Overthinking for Corporate Managers,Ease The Mind,Mara Okonkwo,1,overthinking,false_alarm,corporate_managers,Quiet the Restless Mind
way_stream_sanctuary__default_teacher__corporate_managers__overthinking__spiral,Stop Overthinking: Escaping the Mental Loop,A Field Guide for Corporate Managers Navigating Overthinking,Just Watch,Mara Okonkwo,2,overthinking,spiral,corporate_managers,Quiet the Restless Mind
way_stream_sanctuary__default_teacher__corporate_managers__overthinking__spiral__1hr,Stop Overthinking: Breaking the Thought Loop,Escaping the Mental Loop — Overthinking for Corporate Managers (Breaking the Thought Loop),,Mara Okonkwo,2,overthinking,spiral,corporate_managers,Quiet the Restless Mind
way_stream_sanctuary__default_teacher__corporate_managers__overthinking__watcher,Stop Overthinking: The Observer's Mind,How to Create Distance from Anxious Thoughts and Find Clarity — Overthinking for Corporate Managers (Watching Your Thoughts Without Drowning),Step Back,Mara Okonkwo,3,overthinking,watcher,corporate_managers,Quiet the Restless Mind
way_stream_sanctuary__default_teacher__corporate_managers__overthinking__watcher__1hr,Stop Overthinking: The Space Between You and Your Anxiety,How to Create Distance from Anxious Thoughts and Find Clarity — Overthinking for Corporate Managers (The Observer's Mind),Just Watch,Mara Okonkwo,3,overthinking,watcher,corporate_managers,Quiet the Restless Mind
way_stream_sanctuary__default_teacher__corporate_managers__self_worth__comparison,The Voice That Says Not Enough: Beyond the Highlight Reel,The Comparison Habit,Just You,Theo Castellan,1,self_worth,comparison,corporate_managers,Worth & Limits
way_stream_sanctuary__default_teacher__corporate_managers__self_worth__comparison__1hr,The Voice That Says Not Enough: The Comparison Habit,A Real Talk Guide to Self-Worth for Corporate Managers,Worth Stays,Theo Castellan,1,self_worth,comparison,corporate_managers,Worth & Limits
way_stream_sanctuary__default_teacher__corporate_managers__self_worth__shame,The Voice That Says Not Enough: When You Feel Fundamentally Wrong,A Field Guide for Corporate Managers Navigating Self-Worth,You Belong,Theo Castellan,2,self_worth,shame,corporate_managers,Worth & Limits
way_stream_sanctuary__default_teacher__corporate_managers__self_worth__shame__1hr,The Voice That Says Not Enough: The Shame Response,How Corporate Managers Are Rewriting the Rules of Self-Worth,Worthy Now,Theo Castellan,2,self_worth,shame,corporate_managers,Worth & Limits
way_stream_sanctuary__default_teacher__corporate_managers__sleep_anxiety__false_alarm,Sleep Anxiety: When Your Mind Screams Danger,A Real Talk Guide to Sleep Anxiety for Corporate Managers,Rest Easy,Mara Okonkwo,1,sleep_anxiety,false_alarm,corporate_managers,Quiet the Restless Mind
way_stream_sanctuary__default_teacher__corporate_managers__sleep_anxiety__false_alarm__1hr,Sleep Anxiety: Misreading the Danger Signal,The False Alarm Response,False Alarm,Mara Okonkwo,1,sleep_anxiety,false_alarm,corporate_managers,Quiet the Restless Mind
way_stream_sanctuary__default_teacher__corporate_managers__sleep_anxiety__overwhelm,Sleep Anxiety: When Everything Is Too Much,A Field Guide for Corporate Managers Navigating Sleep Anxiety,Quiet Nights,Mara Okonkwo,2,sleep_anxiety,overwhelm,corporate_managers,Quiet the Restless Mind
way_stream_sanctuary__default_teacher__corporate_managers__sleep_anxiety__overwhelm__1hr,The 3am Mind: When Everything Is Too Much,The Shutdown Point,,Mara Okonkwo,2,sleep_anxiety,overwhelm,corporate_managers,Quiet the Restless Mind
way_stream_sanctuary__default_teacher__corporate_managers__sleep_anxiety__spiral,Sleep Anxiety: Escaping the Mental Loop,How Corporate Managers Are Rewriting the Rules of Sleep Anxiety,Sleep Sound,Mara Okonkwo,3,sleep_anxiety,spiral,corporate_managers,Quiet the Restless Mind
way_stream_sanctuary__default_teacher__corporate_managers__sleep_anxiety__spiral__1hr,The 3am Mind: Escaping the Mental Loop,The Rumination Trap — Sleep Anxiety for Corporate Managers (Breaking the Thought Loop),Let It Rest,Mara Okonkwo,3,sleep_anxiety,spiral,corporate_managers,Quiet the Restless Mind
way_stream_sanctuary__default_teacher__corporate_managers__social_anxiety__comparison,Social Anxiety: Beyond the Highlight Reel,A Field Guide for Corporate Managers Navigating Social Anxiety,At Ease,Mara Okonkwo,1,social_anxiety,comparison,corporate_managers,Brave in the World
way_stream_sanctuary__default_teacher__corporate_managers__social_anxiety__comparison__1hr,Social Anxiety: The Comparison Trap,A Real Talk Guide to Social Anxiety for Corporate Managers,Just Be You,Mara Okonkwo,1,social_anxiety,comparison,corporate_managers,Brave in the World
way_stream_sanctuary__default_teacher__corporate_managers__social_anxiety__false_alarm,Social Anxiety: The False Alarm Response,Why Your Brain Cries Wolf,False Alarm,Mara Okonkwo,2,social_anxiety,false_alarm,corporate_managers,Brave in the World
way_stream_sanctuary__default_teacher__corporate_managers__social_anxiety__false_alarm__1hr,Social Anxiety: The False Alarm Response (1),How Corporate Managers Are Rewriting the Rules of Social Anxiety,Walk In Calm,Mara Okonkwo,2,social_anxiety,false_alarm,corporate_managers,Brave in the World
way_stream_sanctuary__default_teacher__corporate_managers__social_anxiety__shame,Social Anxiety: When You Feel Fundamentally Wrong,What Shame Does to You — Social Anxiety for Corporate Managers (What Shame Does to You),,Mara Okonkwo,3,social_anxiety,shame,corporate_managers,Brave in the World
way_stream_sanctuary__default_teacher__corporate_managers__social_anxiety__shame__1hr,Social Anxiety: The Shame Response,Understanding How Shame Works in Your Body and Mind — and How to Release It — Social Anxiety for Corporate Managers (What Shame Does to You),Set It Down,Mara Okonkwo,3,social_anxiety,shame,corporate_managers,Brave in the World
way_stream_sanctuary__default_teacher__corporate_managers__somatic_healing__overwhelm,Somatic Healing: When Everything Is Too Much,A Field Guide for Corporate Managers Navigating Somatic Healing,Come Home,Theo Castellan,1,somatic_healing,overwhelm,corporate_managers,Through the Low Places
way_stream_sanctuary__default_teacher__corporate_managers__somatic_healing__watcher,Somatic Healing: The Witnessing Practice,A Real Talk Guide to Somatic Healing for Corporate Managers,Body At Ease,Theo Castellan,2,somatic_healing,watcher,corporate_managers,Through the Low Places
way_stream_sanctuary__default_teacher__entrepreneurs__anxiety__comparison,Anxiety Relief: The Comparison Trap,A Real Talk Guide to Anxiety for Entrepreneurs,Steady Now,Devon Hale,1,anxiety,comparison,entrepreneurs,
way_stream_sanctuary__default_teacher__entrepreneurs__anxiety__comparison__1hr,Anxiety Relief: When Other People's Success Feels Like Your Failure,A Field Guide for Entrepreneurs Navigating Anxiety,Find Footing,Devon Hale,1,anxiety,comparison,entrepreneurs,Calm the Alarm
way_stream_sanctuary__default_teacher__entrepreneurs__anxiety__false_alarm,The Alarm Is Lying: The False Alarm Response,How Entrepreneurs Are Rewriting the Rules of Anxiety,Calm Returns,Devon Hale,2,anxiety,false_alarm,entrepreneurs,
way_stream_sanctuary__default_teacher__entrepreneurs__anxiety__false_alarm__1hr,Anxiety Relief: Why Your Brain Cries Wolf,Misreading the Danger Signal,False Alarm,Devon Hale,2,anxiety,false_alarm,entrepreneurs,Calm the Alarm
way_stream_sanctuary__default_teacher__entrepreneurs__anxiety__grief,Anxiety Relief: Living with What You've Lost,After the Loss,,Devon Hale,3,anxiety,grief,entrepreneurs,
way_stream_sanctuary__default_teacher__entrepreneurs__anxiety__grief__1hr,Anxiety Relief: The Grief That Doesn't Leave,When Loss Reshapes Everything,Carry On,Devon Hale,3,anxiety,grief,entrepreneurs,Calm the Alarm
way_stream_sanctuary__default_teacher__entrepreneurs__anxiety__overwhelm,Anxiety Relief: The Shutdown Point,Practical Tools to Regain Control When Life Feels Unmanageable,Take Control,Devon Hale,4,anxiety,overwhelm,entrepreneurs,
way_stream_sanctuary__default_teacher__entrepreneurs__anxiety__overwhelm__1hr,Anxiety Relief: Drowning in Demands,Practical Tools to Regain Control When Life Feels Unmanageable — Anxiety for Entrepreneurs (The Overwhelm Response),One Thing,Devon Hale,4,anxiety,overwhelm,entrepreneurs,Calm the Alarm
way_stream_sanctuary__default_teacher__entrepreneurs__anxiety__shame,Anxiety Relief: The Hidden Weight of Shame,The Shame Response — Anxiety for Entrepreneurs (The Hidden Weight of Shame),,Devon Hale,5,anxiety,shame,entrepreneurs,
way_stream_sanctuary__default_teacher__entrepreneurs__anxiety__shame__1hr,The Alarm Is Lying: The Shame Response,What Shame Does to You — Anxiety for Entrepreneurs (The Hidden Weight of Shame),,Devon Hale,5,anxiety,shame,entrepreneurs,Calm the Alarm
way_stream_sanctuary__default_teacher__entrepreneurs__anxiety__spiral,Anxiety Relief: Breaking the Thought Loop (1),A Step-by-Step Method to Interrupt Spiraling Thoughts Before They Take Over — Anxiety for Entrepreneurs (Breaking the Thought Loop),Break Loop,Devon Hale,6,anxiety,spiral,entrepreneurs,
way_stream_sanctuary__default_teacher__entrepreneurs__anxiety__spiral__1hr,Anxiety Relief: Escaping the Mental Loop,When One Thought Becomes a Thousand — Anxiety for Entrepreneurs (Breaking the Thought Loop),One Thought,Devon Hale,6,anxiety,spiral,entrepreneurs,Calm the Alarm
way_stream_sanctuary__default_teacher__entrepreneurs__anxiety__watcher,Anxiety Relief: The Witnessing Practice,The Witnessing Practice — Anxiety for Entrepreneurs (The Observer's Mind),Just Watch,Devon Hale,7,anxiety,watcher,entrepreneurs,
way_stream_sanctuary__default_teacher__entrepreneurs__anxiety__watcher__1hr,The Alarm Is Lying: The Witnessing Practice,"The Witnessing Practice — Anxiety for Entrepreneurs (The Observer's Mind, 1)",Step Back,Devon Hale,7,anxiety,watcher,entrepreneurs,Calm the Alarm
way_stream_sanctuary__default_teacher__entrepreneurs__boundaries__comparison,Setting Boundaries: The Comparison Habit,How Entrepreneurs Are Rewriting the Rules of Boundaries,Hold Steady,Priya Raman,1,boundaries,comparison,entrepreneurs,Worth & Limits
way_stream_sanctuary__default_teacher__entrepreneurs__boundaries__comparison__1hr,Setting Boundaries: When Other People's Success Feels Like Your Failure,A Real Talk Guide to Boundaries for Entrepreneurs,Say No,Priya Raman,1,boundaries,comparison,entrepreneurs,Worth & Limits
way_stream_sanctuary__default_teacher__entrepreneurs__boundaries__false_alarm,Setting Boundaries: Misreading the Danger Signal (1),A Field Guide for Entrepreneurs Navigating Boundaries,Draw The Line,Priya Raman,2,boundaries,false_alarm,entrepreneurs,Worth & Limits
