book_id,title,subtitle,short_hook,author,installment,topic,engine,persona,cluster
way_stream_sanctuary__default_teacher__gen_x_sandwich__financial_stress__overwhelm,The Paycheck Pressure: Drowning in Demands,A Real Talk Guide to Financial Stress for Gen X Sandwich,Breathe Easy,Sam Meridian,1,financial_stress,overwhelm,gen_x_sandwich,Money Without Panic
way_stream_sanctuary__default_teacher__gen_x_sandwich__financial_stress__shame,The Paycheck Pressure: Carrying What You Can't Say (1),A Field Guide for Gen X Sandwich Navigating Financial Stress,You Are Okay,Sam Meridian,2,financial_stress,shame,gen_x_sandwich,Money Without Panic
way_stream_sanctuary__default_teacher__gen_x_sandwich__financial_stress__spiral,Financial Stress Management: When One Thought Becomes a Thousand,How Gen X Sandwich Are Rewriting the Rules of Financial Stress,Money Calm,Sam Meridian,3,financial_stress,spiral,gen_x_sandwich,Money Without Panic
way_stream_sanctuary__default_teacher__gen_x_sandwich__grief__grief,Grief: When Loss Reshapes Everything (2),A Real Talk Guide to Grief for Gen X Sandwich,Let It Land,Sam Meridian,1,grief,grief,gen_x_sandwich,Through the Low Places
way_stream_sanctuary__default_teacher__gen_x_sandwich__grief__grief__1hr,Grief: When Loss Reshapes Everything (3),A Field Guide for Gen X Sandwich Navigating Grief,Live With Loss,Sam Meridian,1,grief,grief,gen_x_sandwich,Through the Low Places
way_stream_sanctuary__default_teacher__gen_x_sandwich__grief__watcher,Grief: The Observer's Mind (1),How Gen X Sandwich Are Rewriting the Rules of Grief,Hold It Soft,Sam Meridian,2,grief,watcher,gen_x_sandwich,Through the Low Places
way_stream_sanctuary__default_teacher__gen_x_sandwich__grief__watcher__1hr,Grief: The Observer's Mind (2),Watching Your Thoughts Without Drowning — Grief for Gen X Sandwich (The Observer's Mind),Let It Move,Sam Meridian,2,grief,watcher,gen_x_sandwich,Through the Low Places
way_stream_sanctuary__default_teacher__gen_x_sandwich__imposter_syndrome__comparison,Imposter Syndrome: Beyond the Highlight Reel (1),A Real Talk Guide to Imposter Syndrome for Gen X Sandwich,You Belong,Sam Meridian,1,imposter_syndrome,comparison,gen_x_sandwich,Worth & Limits
way_stream_sanctuary__default_teacher__gen_x_sandwich__imposter_syndrome__shame,The Seat You Earned: The Shame Response,A Field Guide for Gen X Sandwich Navigating Imposter Syndrome,You Are Real,Sam Meridian,2,imposter_syndrome,shame,gen_x_sandwich,Worth & Limits
way_stream_sanctuary__default_teacher__gen_x_sandwich__overthinking__false_alarm,Stop Overthinking: Why Your Brain Cries Wolf,A Real Talk Guide to Overthinking for Gen X Sandwich,Quiet Mind,Elena Petrova,1,overthinking,false_alarm,gen_x_sandwich,Quiet the Restless Mind
way_stream_sanctuary__default_teacher__gen_x_sandwich__overthinking__false_alarm__1hr,Stop Overthinking: The False Alarm Response (3),A Field Guide for Gen X Sandwich Navigating Overthinking,Just a Fear,Elena Petrova,1,overthinking,false_alarm,gen_x_sandwich,Quiet the Restless Mind
way_stream_sanctuary__default_teacher__gen_x_sandwich__overthinking__spiral,Stop Overthinking: Breaking the Thought Loop (1),How Gen X Sandwich Are Rewriting the Rules of Overthinking,Quiet Mind,Elena Petrova,2,overthinking,spiral,gen_x_sandwich,Quiet the Restless Mind
way_stream_sanctuary__default_teacher__gen_x_sandwich__overthinking__spiral__1hr,Stop Overthinking: The Overthinking Spiral,The Overthinking Spiral — Overthinking for Gen X Sandwich (Breaking the Thought Loop),Stop Spiraling,Elena Petrova,2,overthinking,spiral,gen_x_sandwich,Quiet the Restless Mind
way_stream_sanctuary__default_teacher__gen_x_sandwich__overthinking__watcher,Stop Overthinking: Watching Your Thoughts Without Drowning (2),How to Create Distance from Anxious Thoughts and Find Clarity — Overthinking for Gen X Sandwich (The Observer's Mind),Find Clarity,Elena Petrova,3,overthinking,watcher,gen_x_sandwich,Quiet the Restless Mind
way_stream_sanctuary__default_teacher__gen_x_sandwich__overthinking__watcher__1hr,The Thought That Won't Leave: The Observer's Mind,How to Create Distance from Anxious Thoughts and Find Clarity — Overthinking for Gen X Sandwich (Watching Your Thoughts Without Drowning),Step Back,Elena Petrova,3,overthinking,watcher,gen_x_sandwich,Quiet the Restless Mind
way_stream_sanctuary__default_teacher__gen_x_sandwich__self_worth__comparison,The Voice That Says Not Enough: When Other People's Success Feels Like Your Failure (1),A Real Talk Guide to Self-Worth for Gen X Sandwich,You Enough,Sam Meridian,1,self_worth,comparison,gen_x_sandwich,Worth & Limits
way_stream_sanctuary__default_teacher__gen_x_sandwich__self_worth__comparison__1hr,The Voice That Says Not Enough: Measuring Yourself Against Everyone,How Gen X Sandwich Are Rewriting the Rules of Self-Worth,You Belong,Sam Meridian,1,self_worth,comparison,gen_x_sandwich,Worth & Limits
way_stream_sanctuary__default_teacher__gen_x_sandwich__self_worth__shame,The Voice That Says Not Enough: The Hidden Weight of Shame (1),A Field Guide for Gen X Sandwich Navigating Self-Worth,You Matter,Sam Meridian,2,self_worth,shame,gen_x_sandwich,Worth & Limits
way_stream_sanctuary__default_teacher__gen_x_sandwich__self_worth__shame__1hr,Building Self Worth: The Shame Response,Carrying What You Can't Say — Self-Worth for Gen X Sandwich (The Hidden Weight of Shame),,Sam Meridian,2,self_worth,shame,gen_x_sandwich,Worth & Limits
way_stream_sanctuary__default_teacher__gen_x_sandwich__sleep_anxiety__false_alarm,Sleep Anxiety: When Your Mind Screams Danger (2),A Real Talk Guide to Sleep Anxiety for Gen X Sandwich,Rest Easy,Elena Petrova,1,sleep_anxiety,false_alarm,gen_x_sandwich,Quiet the Restless Mind
way_stream_sanctuary__default_teacher__gen_x_sandwich__sleep_anxiety__false_alarm__1hr,The 3am Mind: Why Your Brain Cries Wolf,A Field Guide for Gen X Sandwich Navigating Sleep Anxiety,Safe to Rest,Elena Petrova,1,sleep_anxiety,false_alarm,gen_x_sandwich,Quiet the Restless Mind
way_stream_sanctuary__default_teacher__gen_x_sandwich__sleep_anxiety__overwhelm,The 3am Mind: The Overwhelm Response,How Gen X Sandwich Are Rewriting the Rules of Sleep Anxiety,Wind It Down,Elena Petrova,2,sleep_anxiety,overwhelm,gen_x_sandwich,Quiet the Restless Mind
way_stream_sanctuary__default_teacher__gen_x_sandwich__sleep_anxiety__overwhelm__1hr,Sleep Anxiety: When Everything Is Too Much (1),Practical Tools to Regain Control When Life Feels Unmanageable — Sleep Anxiety for Gen X Sandwich (When Everything Is Too Much),Let Rest In,Elena Petrova,2,sleep_anxiety,overwhelm,gen_x_sandwich,Quiet the Restless Mind
way_stream_sanctuary__default_teacher__gen_x_sandwich__sleep_anxiety__spiral,Sleep Anxiety: When One Thought Becomes a Thousand (1),When One Thought Becomes a Thousand — Sleep Anxiety for Gen X Sandwich (Breaking the Thought Loop),Quiet Mind,Elena Petrova,3,sleep_anxiety,spiral,gen_x_sandwich,Quiet the Restless Mind
way_stream_sanctuary__default_teacher__gen_x_sandwich__sleep_anxiety__spiral__1hr,The 3am Mind: The Rumination Trap,The Rumination Trap — Sleep Anxiety for Gen X Sandwich (Breaking the Thought Loop),Stop Spiraling,Elena Petrova,3,sleep_anxiety,spiral,gen_x_sandwich,Quiet the Restless Mind
way_stream_sanctuary__default_teacher__gen_x_sandwich__social_anxiety__comparison,Social Anxiety: The Comparison Habit (1),A Real Talk Guide to Social Anxiety for Gen X Sandwich,Just Be You,Elena Petrova,1,social_anxiety,comparison,gen_x_sandwich,Brave in the World
way_stream_sanctuary__default_teacher__gen_x_sandwich__social_anxiety__comparison__1hr,Social Anxiety: The Comparison Habit (2),A Field Guide for Gen X Sandwich Navigating Social Anxiety,At Ease,Elena Petrova,1,social_anxiety,comparison,gen_x_sandwich,Brave in the World
way_stream_sanctuary__default_teacher__gen_x_sandwich__social_anxiety__false_alarm,Social Anxiety: The False Alarm Response (3),How Gen X Sandwich Are Rewriting the Rules of Social Anxiety,Safe to Show,Elena Petrova,2,social_anxiety,false_alarm,gen_x_sandwich,Brave in the World
way_stream_sanctuary__default_teacher__gen_x_sandwich__social_anxiety__false_alarm__1hr,Social Anxiety: When Your Mind Screams Danger (2),The False Alarm Response — Social Anxiety for Gen X Sandwich (When Your Mind Screams Danger),,Elena Petrova,2,social_anxiety,false_alarm,gen_x_sandwich,Brave in the World
way_stream_sanctuary__default_teacher__gen_x_sandwich__social_anxiety__shame,Social Anxiety: What Shame Does to You,What Shame Does to You — Social Anxiety for Gen X Sandwich (What Shame Does to You),,Elena Petrova,3,social_anxiety,shame,gen_x_sandwich,Brave in the World
way_stream_sanctuary__default_teacher__gen_x_sandwich__social_anxiety__shame__1hr,Social Anxiety: Carrying What You Can't Say (2),Understanding How Shame Works in Your Body and Mind — and How to Release It — Social Anxiety for Gen X Sandwich (What Shame Does to You),Lose the Mask,Elena Petrova,3,social_anxiety,shame,gen_x_sandwich,Brave in the World
way_stream_sanctuary__default_teacher__gen_x_sandwich__somatic_healing__overwhelm,"Somatic Healing: Too Many Things, Not Enough You",A Real Talk Guide to Somatic Healing for Gen X Sandwich,Home in Body,Sam Meridian,1,somatic_healing,overwhelm,gen_x_sandwich,Through the Low Places
way_stream_sanctuary__default_teacher__gen_x_sandwich__somatic_healing__watcher,What the Body Remembers: Watching Your Thoughts Without Drowning,How Gen X Sandwich Are Rewriting the Rules of Somatic Healing,Heal in Body,Sam Meridian,2,somatic_healing,watcher,gen_x_sandwich,Through the Low Places
way_stream_sanctuary__default_teacher__gen_z_professionals__anxiety__comparison,The Alarm Is Lying: Measuring Yourself Against Everyone,A Field Guide for Gen Z Professionals Navigating Anxiety,Steady Now,Ravi Chandra,1,anxiety,comparison,gen_z_professionals,
way_stream_sanctuary__default_teacher__gen_z_professionals__anxiety__comparison__1hr,Anxiety Relief: Measuring Yourself Against Everyone (1),A Real Talk Guide to Anxiety for Gen Z Professionals,Find Calm,Ravi Chandra,1,anxiety,comparison,gen_z_professionals,Calm the Alarm
way_stream_sanctuary__default_teacher__gen_z_professionals__anxiety__false_alarm,Anxiety Relief: Why Your Brain Cries Wolf (1),How Gen Z Professionals Are Rewriting the Rules of Anxiety,False Alarm,Ravi Chandra,2,anxiety,false_alarm,gen_z_professionals,
way_stream_sanctuary__default_teacher__gen_z_professionals__anxiety__false_alarm__1hr,Anxiety Relief: Why Your Brain Cries Wolf (2),The False Alarm Response — Anxiety for Gen Z Professionals (The False Alarm Response),Just a Wave,Ravi Chandra,2,anxiety,false_alarm,gen_z_professionals,Calm the Alarm
way_stream_sanctuary__default_teacher__gen_z_professionals__anxiety__grief,The Alarm Is Lying: Living with What You've Lost,After the Loss — Anxiety for Gen Z Professionals (The Weight You Carry),,Ravi Chandra,3,anxiety,grief,gen_z_professionals,
way_stream_sanctuary__default_teacher__gen_z_professionals__anxiety__grief__1hr,Anxiety Relief: Living with What You've Lost (1),A Gentle Guide to Moving Through Grief Without Forcing Yourself to 'Get Over It' — Anxiety for Gen Z Professionals (When Loss Reshapes Everything),Let It Land,Ravi Chandra,3,anxiety,grief,gen_z_professionals,Calm the Alarm
way_stream_sanctuary__default_teacher__gen_z_professionals__anxiety__overwhelm,"Anxiety Relief: Too Many Things, Not Enough You",The Shutdown Point — Anxiety for Gen Z Professionals (When Everything Is Too Much),,Ravi Chandra,4,anxiety,overwhelm,gen_z_professionals,
way_stream_sanctuary__default_teacher__gen_z_professionals__anxiety__overwhelm__1hr,"The Alarm Is Lying: Too Many Things, Not Enough You","The Shutdown Point — Anxiety for Gen Z Professionals (When Everything Is Too Much, 1)",,Ravi Chandra,4,anxiety,overwhelm,gen_z_professionals,Calm the Alarm
way_stream_sanctuary__default_teacher__gen_z_professionals__anxiety__shame,Anxiety Relief: Carrying What You Can't Say (3),The Shame Response — Anxiety for Gen Z Professionals (The Hidden Weight of Shame),,Ravi Chandra,5,anxiety,shame,gen_z_professionals,
way_stream_sanctuary__default_teacher__gen_z_professionals__anxiety__shame__1hr,Anxiety Relief: The Shame Response (2),Understanding How Shame Works in Your Body and Mind — and How to Release It — Anxiety for Gen Z Professionals (The Hidden Weight of Shame),Let It Go,Ravi Chandra,5,anxiety,shame,gen_z_professionals,Calm the Alarm
way_stream_sanctuary__default_teacher__gen_z_professionals__anxiety__spiral,Anxiety Relief: When One Thought Becomes a Thousand (1),Escaping the Mental Loop — Anxiety for Gen Z Professionals (Breaking the Thought Loop),,Ravi Chandra,6,anxiety,spiral,gen_z_professionals,
way_stream_sanctuary__default_teacher__gen_z_professionals__anxiety__spiral__1hr,Anxiety Relief: When One Thought Becomes a Thousand (2),"Escaping the Mental Loop — Anxiety for Gen Z Professionals (Breaking the Thought Loop, 1)",,Ravi Chandra,6,anxiety,spiral,gen_z_professionals,Calm the Alarm
way_stream_sanctuary__default_teacher__gen_z_professionals__anxiety__watcher,Anxiety Relief: The Space Between You and Your Anxiety,The Witnessing Practice — Anxiety for Gen Z Professionals (The Observer's Mind),,Ravi Chandra,7,anxiety,watcher,gen_z_professionals,
way_stream_sanctuary__default_teacher__gen_z_professionals__anxiety__watcher__1hr,Anxiety Relief: Watching Your Thoughts Without Drowning (1),Watching Your Thoughts Without Drowning — Anxiety for Gen Z Professionals (The Observer's Mind),Just Watch,Ravi Chandra,7,anxiety,watcher,gen_z_professionals,Calm the Alarm
way_stream_sanctuary__default_teacher__gen_z_professionals__boundaries__comparison,Setting Boundaries: The Comparison Trap,A Real Talk Guide to Boundaries for Gen Z Professionals,Set the Line,Wren Adler,1,boundaries,comparison,gen_z_professionals,Worth & Limits
way_stream_sanctuary__default_teacher__gen_z_professionals__boundaries__comparison__1hr,Setting Boundaries: The Comparison Habit (2),A Field Guide for Gen Z Professionals Navigating Boundaries,Own Your No,Wren Adler,1,boundaries,comparison,gen_z_professionals,Worth & Limits
way_stream_sanctuary__default_teacher__gen_z_professionals__boundaries__false_alarm,The Line You Never Drew: Why Your Brain Cries Wolf,How Gen Z Professionals Are Rewriting the Rules of Boundaries,Stand Firm,Wren Adler,2,boundaries,false_alarm,gen_z_professionals,Worth & Limits
way_stream_sanctuary__default_teacher__gen_z_professionals__boundaries__false_alarm__1hr,Setting Boundaries: Why Your Brain Cries Wolf (1),The False Alarm Response — Boundaries for Gen Z Professionals (The False Alarm Response),,Wren Adler,2,boundaries,false_alarm,gen_z_professionals,Worth & Limits
way_stream_sanctuary__default_teacher__gen_z_professionals__boundaries__shame,The Line You Never Drew: The Hidden Weight of Shame,Understanding How Shame Works in Your Body and Mind — and How to Release It — Boundaries for Gen Z Professionals (What Shame Does to You),Your No Wins,Wren Adler,3,boundaries,shame,gen_z_professionals,Worth & Limits
way_stream_sanctuary__default_teacher__gen_z_professionals__boundaries__shame__1hr,Setting Boundaries: When You Feel Fundamentally Wrong (1),What Shame Does to You — Boundaries for Gen Z Professionals (The Hidden Weight of Shame),,Wren Adler,3,boundaries,shame,gen_z_professionals,Worth & Limits
way_stream_sanctuary__default_teacher__gen_z_professionals__burnout__grief,Burnout Recovery: The Grief That Doesn't Leave (3),A Real Talk Guide to Burnout for Gen Z Professionals,Refill You,Wren Adler,1,burnout,grief,gen_z_professionals,Refill the Empty Well
way_stream_sanctuary__default_teacher__gen_z_professionals__burnout__grief__1hr,After the Flame: After the Loss,A Field Guide for Gen Z Professionals Navigating Burnout,Running Low,Wren Adler,1,burnout,grief,gen_z_professionals,Steady Ground
way_stream_sanctuary__default_teacher__gen_z_professionals__burnout__overwhelm,"Burnout Recovery: Too Many Things, Not Enough You",How Gen Z Professionals Are Rewriting the Rules of Burnout,Rest Easy,Wren Adler,2,burnout,overwhelm,gen_z_professionals,Refill the Empty Well
way_stream_sanctuary__default_teacher__gen_z_professionals__burnout__overwhelm__1hr,Burnout Recovery: Drowning in Demands (3),Practical Tools to Regain Control When Life Feels Unmanageable — Burnout for Gen Z Professionals (When Everything Is Too Much),Take Back,Wren Adler,2,burnout,overwhelm,gen_z_professionals,Steady Ground
way_stream_sanctuary__default_teacher__gen_z_professionals__burnout__watcher,Burnout Recovery: The Space Between You and Your Anxiety (2),How to Create Distance from Anxious Thoughts and Find Clarity — Burnout for Gen Z Professionals (Watching Your Thoughts Without Drowning),Step Back,Wren Adler,3,burnout,watcher,gen_z_professionals,Refill the Empty Well
way_stream_sanctuary__default_teacher__gen_z_professionals__burnout__watcher__1hr,After the Flame: The Witnessing Practice,How to Create Distance from Anxious Thoughts and Find Clarity — Burnout for Gen Z Professionals (The Observer's Mind),Let It Pass,Wren Adler,3,burnout,watcher,gen_z_professionals,Steady Ground
way_stream_sanctuary__default_teacher__gen_z_professionals__compassion_fatigue__grief,Compassion Fatigue: Living with What You've Lost (1),A Real Talk Guide to Compassion Fatigue for Gen Z Professionals,Refill Up,Wren Adler,1,compassion_fatigue,grief,gen_z_professionals,Refill the Empty Well
way_stream_sanctuary__default_teacher__gen_z_professionals__compassion_fatigue__overwhelm,"Compassion Fatigue: Too Many Things, Not Enough You",A Field Guide for Gen Z Professionals Navigating Compassion Fatigue,You Too,Wren Adler,2,compassion_fatigue,overwhelm,gen_z_professionals,Refill the Empty Well
way_stream_sanctuary__default_teacher__gen_z_professionals__compassion_fatigue__watcher,The Cost of Caring: The Witnessing Practice,How Gen Z Professionals Are Rewriting the Rules of Compassion Fatigue,Care Again,Wren Adler,3,compassion_fatigue,watcher,gen_z_professionals,Refill the Empty Well
way_stream_sanctuary__default_teacher__gen_z_professionals__courage__false_alarm,Building Courage: Why Your Brain Cries Wolf (1),A Real Talk Guide to Courage for Gen Z Professionals,Begin Again,Ravi Chandra,1,courage,false_alarm,gen_z_professionals,Brave in the World
way_stream_sanctuary__default_teacher__gen_z_professionals__courage__false_alarm__1hr,Building Courage: Why Your Brain Cries Wolf (2),How Gen Z Professionals Are Rewriting the Rules of Courage,Brave Move,Ravi Chandra,1,courage,false_alarm,gen_z_professionals,Brave in the World
way_stream_sanctuary__default_teacher__gen_z_professionals__courage__shame,The Thing You Won't Say: The Hidden Weight of Shame,A Field Guide for Gen Z Professionals Navigating Courage,Stand Tall,Ravi Chandra,2,courage,shame,gen_z_professionals,Brave in the World
way_stream_sanctuary__default_teacher__gen_z_professionals__courage__shame__1hr,Building Courage: The Hidden Weight of Shame (1),Understanding How Shame Works in Your Body and Mind — and How to Release It — Courage for Gen Z Professionals (What Shame Does to You),Drop The Mask,Ravi Chandra,2,courage,shame,gen_z_professionals,Brave in the World
way_stream_sanctuary__default_teacher__gen_z_professionals__courage__spiral,The Thing You Won't Say: The Rumination Trap,The Overthinking Spiral — Courage for Gen Z Professionals (Breaking the Thought Loop),Step Forward,Ravi Chandra,3,courage,spiral,gen_z_professionals,Brave in the World
way_stream_sanctuary__default_teacher__gen_z_professionals__courage__spiral__1hr,Building Courage: The Rumination Trap (1),A Step-by-Step Method to Interrupt Spiraling Thoughts Before They Take Over — Courage for Gen Z Professionals (The Overthinking Spiral),Be Brave,Ravi Chandra,3,courage,spiral,gen_z_professionals,Brave in the World
way_stream_sanctuary__default_teacher__gen_z_professionals__depression__grief,Overcoming Depression: The Grief That Doesn't Leave (3),A Field Guide for Gen Z Professionals Navigating Depression,Lighter Days,Wren Adler,1,depression,grief,gen_z_professionals,Through the Low Places
way_stream_sanctuary__default_teacher__gen_z_professionals__depression__grief__1hr,Overcoming Depression: The Grief That Doesn't Leave (4),How Gen Z Professionals Are Rewriting the Rules of Depression,Find Light,Wren Adler,1,depression,grief,gen_z_professionals,Through the Low Places
way_stream_sanctuary__default_teacher__gen_z_professionals__depression__overwhelm,"The Weight Without a Name: Too Many Things, Not Enough You",A Real Talk Guide to Depression for Gen Z Professionals,Small Steps,Wren Adler,2,depression,overwhelm,gen_z_professionals,Through the Low Places
way_stream_sanctuary__default_teacher__gen_z_professionals__depression__overwhelm__1hr,"Overcoming Depression: Too Many Things, Not Enough You (1)",The Overwhelm Response — Depression for Gen Z Professionals (When Everything Is Too Much),,Wren Adler,2,depression,overwhelm,gen_z_professionals,Through the Low Places
way_stream_sanctuary__default_teacher__gen_z_professionals__depression__watcher,Overcoming Depression: The Witnessing Practice (1),The Space Between You and Your Anxiety — Depression for Gen Z Professionals (The Observer's Mind),Make Space,Wren Adler,3,depression,watcher,gen_z_professionals,Through the Low Places
way_stream_sanctuary__default_teacher__gen_z_professionals__depression__watcher__1hr,The Weight Without a Name: The Space Between You and Your Anxiety,The Witnessing Practice — Depression for Gen Z Professionals (The Observer's Mind),,Wren Adler,3,depression,watcher,gen_z_professionals,Through the Low Places
way_stream_sanctuary__default_teacher__gen_z_professionals__financial_anxiety__overwhelm,"The Number in Your Head: Too Many Things, Not Enough You",A Real Talk Guide to Financial Anxiety for Gen Z Professionals,Money Calm,Wren Adler,1,financial_anxiety,overwhelm,gen_z_professionals,Money Without Panic
way_stream_sanctuary__default_teacher__gen_z_professionals__financial_anxiety__overwhelm__1hr,Financial Anxiety: The Overwhelm Response (1),A Field Guide for Gen Z Professionals Navigating Financial Anxiety,Steady Now,Wren Adler,1,financial_anxiety,overwhelm,gen_z_professionals,Steady Ground
way_stream_sanctuary__default_teacher__gen_z_professionals__financial_anxiety__shame,Financial Anxiety: The Hidden Weight of Shame (1),How Gen Z Professionals Are Rewriting the Rules of Financial Anxiety,Money Ease,Wren Adler,2,financial_anxiety,shame,gen_z_professionals,Money Without Panic
way_stream_sanctuary__default_teacher__gen_z_professionals__financial_anxiety__shame__1hr,Financial Anxiety: Carrying What You Can't Say (3),The Shame Response — Financial Anxiety for Gen Z Professionals (The Hidden Weight of Shame),,Wren Adler,2,financial_anxiety,shame,gen_z_professionals,Steady Ground
way_stream_sanctuary__default_teacher__gen_z_professionals__financial_anxiety__spiral,Financial Anxiety: The Rumination Trap,The Rumination Trap — Financial Anxiety for Gen Z Professionals (Breaking the Thought Loop),,Wren Adler,3,financial_anxiety,spiral,gen_z_professionals,Money Without Panic
way_stream_sanctuary__default_teacher__gen_z_professionals__financial_anxiety__spiral__1hr,The Number in Your Head: The Rumination Trap,A Step-by-Step Method to Interrupt Spiraling Thoughts Before They Take Over — Financial Anxiety for Gen Z Professionals (The Overthinking Spiral),Stop The Loop,Wren Adler,3,financial_anxiety,spiral,gen_z_professionals,Steady Ground
way_stream_sanctuary__default_teacher__gen_z_professionals__financial_stress__overwhelm,"The Paycheck Pressure: Too Many Things, Not Enough You",How Gen Z Professionals Are Rewriting the Rules of Financial Stress,Ease Money,Wren Adler,1,financial_stress,overwhelm,gen_z_professionals,Money Without Panic
way_stream_sanctuary__default_teacher__gen_z_professionals__financial_stress__shame,The Paycheck Pressure: The Hidden Weight of Shame,A Real Talk Guide to Financial Stress for Gen Z Professionals,Ease Up,Wren Adler,2,financial_stress,shame,gen_z_professionals,Money Without Panic
way_stream_sanctuary__default_teacher__gen_z_professionals__financial_stress__spiral,The Paycheck Pressure: The Rumination Trap,A Field Guide for Gen Z Professionals Navigating Financial Stress,Break Free,Wren Adler,3,financial_stress,spiral,gen_z_professionals,Money Without Panic
way_stream_sanctuary__default_teacher__gen_z_professionals__grief__grief,Grief: After the Loss (1),A Real Talk Guide to Grief for Gen Z Professionals,Let It Land,Wren Adler,1,grief,grief,gen_z_professionals,Through the Low Places
way_stream_sanctuary__default_teacher__gen_z_professionals__grief__grief__1hr,Grief: After the Loss (2),A Field Guide for Gen Z Professionals Navigating Grief,Hold It Soft,Wren Adler,1,grief,grief,gen_z_professionals,Through the Low Places
way_stream_sanctuary__default_teacher__gen_z_professionals__grief__watcher,Grief: Watching Your Thoughts Without Drowning (3),How Gen Z Professionals Are Rewriting the Rules of Grief,Carry On,Wren Adler,2,grief,watcher,gen_z_professionals,Through the Low Places
way_stream_sanctuary__default_teacher__gen_z_professionals__grief__watcher__1hr,Grief: The Witnessing Practice (1),Stepping Back from the Storm — Grief for Gen Z Professionals (The Observer's Mind),,Wren Adler,2,grief,watcher,gen_z_professionals,Through the Low Places
way_stream_sanctuary__default_teacher__gen_z_professionals__imposter_syndrome__comparison,The Seat You Earned: Measuring Yourself Against Everyone,A Real Talk Guide to Imposter Syndrome for Gen Z Professionals,You Belong,Wren Adler,1,imposter_syndrome,comparison,gen_z_professionals,Worth & Limits
way_stream_sanctuary__default_teacher__gen_z_professionals__imposter_syndrome__shame,The Seat You Earned: The Hidden Weight of Shame,A Field Guide for Gen Z Professionals Navigating Imposter Syndrome,Own It,Wren Adler,2,imposter_syndrome,shame,gen_z_professionals,Worth & Limits
