book_id,title,subtitle,short_hook,author,installment,topic,engine,persona,cluster
way_stream_sanctuary__default_teacher__millennial_women_professionals__self_worth__shame__1hr,Building Self Worth: What Shame Does to You,What Shame Does to You — Self-Worth for Millennial Women Professionals (What Shame Does to You),,Grace Adeyemi,2,self_worth,shame,millennial_women_professionals,Worth & Limits
way_stream_sanctuary__default_teacher__millennial_women_professionals__sleep_anxiety__false_alarm,Sleep Anxiety: When Fear Lies to You,A Real Talk Guide to Sleep Anxiety for Millennial Women Professionals,Rest Easy,Sofia Marchetti,1,sleep_anxiety,false_alarm,millennial_women_professionals,Quiet the Restless Mind
way_stream_sanctuary__default_teacher__millennial_women_professionals__sleep_anxiety__false_alarm__1hr,Sleep Anxiety: When Your Mind Screams Danger (4),A Field Guide for Millennial Women Professionals Navigating Sleep Anxiety,Rest Easy,Sofia Marchetti,1,sleep_anxiety,false_alarm,millennial_women_professionals,Quiet the Restless Mind
way_stream_sanctuary__default_teacher__millennial_women_professionals__sleep_anxiety__overwhelm,Sleep Anxiety: The Overwhelm Response (2),How Millennial Women Professionals Are Rewriting the Rules of Sleep Anxiety,Sleep Now,Sofia Marchetti,2,sleep_anxiety,overwhelm,millennial_women_professionals,Quiet the Restless Mind
way_stream_sanctuary__default_teacher__millennial_women_professionals__sleep_anxiety__overwhelm__1hr,Sleep Anxiety: Drowning in Demands (3),The Overwhelm Response — Sleep Anxiety for Millennial Women Professionals (When Everything Is Too Much),,Sofia Marchetti,2,sleep_anxiety,overwhelm,millennial_women_professionals,Quiet the Restless Mind
way_stream_sanctuary__default_teacher__millennial_women_professionals__sleep_anxiety__spiral,Sleep Anxiety: Breaking the Thought Loop (2),A Step-by-Step Method to Interrupt Spiraling Thoughts Before They Take Over — Sleep Anxiety for Millennial Women Professionals (Breaking the Thought Loop),Quiet Nights,Sofia Marchetti,3,sleep_anxiety,spiral,millennial_women_professionals,Quiet the Restless Mind
way_stream_sanctuary__default_teacher__millennial_women_professionals__sleep_anxiety__spiral__1hr,Sleep Anxiety: The Rumination Trap (1),A Step-by-Step Method to Interrupt Spiraling Thoughts Before They Take Over — Sleep Anxiety for Millennial Women Professionals (The Overthinking Spiral),Quiet Nights,Sofia Marchetti,3,sleep_anxiety,spiral,millennial_women_professionals,Quiet the Restless Mind
way_stream_sanctuary__default_teacher__millennial_women_professionals__social_anxiety__comparison,Social Anxiety: The Comparison Trap (1),How Millennial Women Professionals Are Rewriting the Rules of Social Anxiety,Just Show Up,Sofia Marchetti,1,social_anxiety,comparison,millennial_women_professionals,Brave in the World
way_stream_sanctuary__default_teacher__millennial_women_professionals__social_anxiety__comparison__1hr,Social Anxiety: The Comparison Trap (2),A Real Talk Guide to Social Anxiety for Millennial Women Professionals,Just Show Up,Sofia Marchetti,1,social_anxiety,comparison,millennial_women_professionals,Brave in the World
way_stream_sanctuary__default_teacher__millennial_women_professionals__social_anxiety__false_alarm,Social Anxiety: When Fear Lies to You (3),A Field Guide for Millennial Women Professionals Navigating Social Anxiety,Ease In,Sofia Marchetti,2,social_anxiety,false_alarm,millennial_women_professionals,Brave in the World
way_stream_sanctuary__default_teacher__millennial_women_professionals__social_anxiety__false_alarm__1hr,Social Anxiety: When Fear Lies to You (4),The False Alarm Response — Social Anxiety for Millennial Women Professionals (When Your Mind Screams Danger),,Sofia Marchetti,2,social_anxiety,false_alarm,millennial_women_professionals,Brave in the World
way_stream_sanctuary__default_teacher__millennial_women_professionals__social_anxiety__shame,Social Anxiety: When You Feel Fundamentally Wrong (4),Understanding How Shame Works in Your Body and Mind — and How to Release It — Social Anxiety for Millennial Women Professionals (The Hidden Weight of Shame),Let It Go,Sofia Marchetti,3,social_anxiety,shame,millennial_women_professionals,Brave in the World
way_stream_sanctuary__default_teacher__millennial_women_professionals__social_anxiety__shame__1hr,Social Anxiety: What Shame Does to You (1),The Shame Response — Social Anxiety for Millennial Women Professionals (The Hidden Weight of Shame),,Sofia Marchetti,3,social_anxiety,shame,millennial_women_professionals,Brave in the World
way_stream_sanctuary__default_teacher__millennial_women_professionals__somatic_healing__overwhelm,Somatic Healing: The Overwhelm Response (2),A Real Talk Guide to Somatic Healing for Millennial Women Professionals,Come Home,Grace Adeyemi,1,somatic_healing,overwhelm,millennial_women_professionals,Through the Low Places
way_stream_sanctuary__default_teacher__millennial_women_professionals__somatic_healing__watcher,Somatic Healing: The Space Between You and Your Anxiety,A Field Guide for Millennial Women Professionals Navigating Somatic Healing,Come Home,Grace Adeyemi,2,somatic_healing,watcher,millennial_women_professionals,Through the Low Places
way_stream_sanctuary__default_teacher__tech_finance_burnout__anxiety__comparison,Anxiety Relief: Measuring Yourself Against Everyone (3),A Real Talk Guide to Anxiety for Tech Finance Burnout,Steady Now,Daniel Cho,1,anxiety,comparison,tech_finance_burnout,
way_stream_sanctuary__default_teacher__tech_finance_burnout__anxiety__comparison__1hr,The Alarm Is Lying: When Other People's Success Feels Like Your Failure,A Field Guide for Tech Finance Burnout Navigating Anxiety,Steady Now,Daniel Cho,1,anxiety,comparison,tech_finance_burnout,Calm the Alarm
way_stream_sanctuary__default_teacher__tech_finance_burnout__anxiety__false_alarm,Anxiety Relief: Misreading the Danger Signal (2),How Tech Finance Burnout Are Rewriting the Rules of Anxiety,False Alarm,Daniel Cho,2,anxiety,false_alarm,tech_finance_burnout,
way_stream_sanctuary__default_teacher__tech_finance_burnout__anxiety__false_alarm__1hr,Anxiety Relief: The False Alarm Response (4),How to Recognize When Anxiety Is a False Alarm — and What to Do Instead — Anxiety for Tech Finance Burnout (When Your Mind Screams Danger),Quiet It,Daniel Cho,2,anxiety,false_alarm,tech_finance_burnout,Calm the Alarm
way_stream_sanctuary__default_teacher__tech_finance_burnout__anxiety__grief,Anxiety Relief: When Loss Reshapes Everything,A Gentle Guide to Moving Through Grief Without Forcing Yourself to 'Get Over It' — Anxiety for Tech Finance Burnout (When Loss Reshapes Everything),Let It Land,Daniel Cho,3,anxiety,grief,tech_finance_burnout,
way_stream_sanctuary__default_teacher__tech_finance_burnout__anxiety__grief__1hr,The Alarm Is Lying: When Loss Reshapes Everything,"A Gentle Guide to Moving Through Grief Without Forcing Yourself to 'Get Over It' — Anxiety for Tech Finance Burnout (When Loss Reshapes Everything, 1)",Let It Land,Daniel Cho,3,anxiety,grief,tech_finance_burnout,Calm the Alarm
way_stream_sanctuary__default_teacher__tech_finance_burnout__anxiety__overwhelm,"Anxiety Relief: Too Many Things, Not Enough You (3)",Drowning in Demands — Anxiety for Tech Finance Burnout (When Everything Is Too Much),Set It Down,Daniel Cho,4,anxiety,overwhelm,tech_finance_burnout,
way_stream_sanctuary__default_teacher__tech_finance_burnout__anxiety__overwhelm__1hr,Anxiety Relief: The Overwhelm Response (1),The Overwhelm Response — Anxiety for Tech Finance Burnout (When Everything Is Too Much),Set It Down,Daniel Cho,4,anxiety,overwhelm,tech_finance_burnout,Calm the Alarm
way_stream_sanctuary__default_teacher__tech_finance_burnout__anxiety__shame,Anxiety Relief: Carrying What You Can't Say (6),Understanding How Shame Works in Your Body and Mind — and How to Release It — Anxiety for Tech Finance Burnout (The Hidden Weight of Shame),Let It Go,Daniel Cho,5,anxiety,shame,tech_finance_burnout,
way_stream_sanctuary__default_teacher__tech_finance_burnout__anxiety__shame__1hr,The Alarm Is Lying: When You Feel Fundamentally Wrong,The Shame Response — Anxiety for Tech Finance Burnout (The Hidden Weight of Shame),Let It Go,Daniel Cho,5,anxiety,shame,tech_finance_burnout,Calm the Alarm
way_stream_sanctuary__default_teacher__tech_finance_burnout__anxiety__spiral,Anxiety Relief: Breaking the Thought Loop (3),The Overthinking Spiral — Anxiety for Tech Finance Burnout (The Overthinking Spiral),Step Off,Daniel Cho,6,anxiety,spiral,tech_finance_burnout,
way_stream_sanctuary__default_teacher__tech_finance_burnout__anxiety__spiral__1hr,Anxiety Relief: Breaking the Thought Loop (4),"The Overthinking Spiral — Anxiety for Tech Finance Burnout (The Overthinking Spiral, 1)",One Thought,Daniel Cho,6,anxiety,spiral,tech_finance_burnout,Calm the Alarm
way_stream_sanctuary__default_teacher__tech_finance_burnout__anxiety__watcher,Anxiety Relief: Watching Your Thoughts Without Drowning (3),The Witnessing Practice — Anxiety for Tech Finance Burnout (The Observer's Mind),Just Watch,Daniel Cho,7,anxiety,watcher,tech_finance_burnout,
way_stream_sanctuary__default_teacher__tech_finance_burnout__anxiety__watcher__1hr,Anxiety Relief: The Observer's Mind (4),The Space Between You and Your Anxiety — Anxiety for Tech Finance Burnout (The Observer's Mind),Make Space,Daniel Cho,7,anxiety,watcher,tech_finance_burnout,Calm the Alarm
way_stream_sanctuary__default_teacher__tech_finance_burnout__boundaries__comparison,Setting Boundaries: Measuring Yourself Against Everyone (2),A Real Talk Guide to Boundaries for Tech Finance Burnout,Hold Firm,Ana Reyes,1,boundaries,comparison,tech_finance_burnout,Worth & Limits
way_stream_sanctuary__default_teacher__tech_finance_burnout__boundaries__comparison__1hr,The Line You Never Drew: The Comparison Trap,A Field Guide for Tech Finance Burnout Navigating Boundaries,Hold Firm,Ana Reyes,1,boundaries,comparison,tech_finance_burnout,Worth & Limits
way_stream_sanctuary__default_teacher__tech_finance_burnout__boundaries__false_alarm,Setting Boundaries: Misreading the Danger Signal (3),How Tech Finance Burnout Are Rewriting the Rules of Boundaries,Say No,Ana Reyes,2,boundaries,false_alarm,tech_finance_burnout,Worth & Limits
way_stream_sanctuary__default_teacher__tech_finance_burnout__boundaries__false_alarm__1hr,Setting Boundaries: When Fear Lies to You (3),The False Alarm Response — Boundaries for Tech Finance Burnout (The False Alarm Response),Say No,Ana Reyes,2,boundaries,false_alarm,tech_finance_burnout,Worth & Limits
way_stream_sanctuary__default_teacher__tech_finance_burnout__boundaries__shame,The Line You Never Drew: The Shame Response,What Shame Does to You — Boundaries for Tech Finance Burnout (The Hidden Weight of Shame),,Ana Reyes,3,boundaries,shame,tech_finance_burnout,Worth & Limits
way_stream_sanctuary__default_teacher__tech_finance_burnout__boundaries__shame__1hr,Setting Boundaries: Carrying What You Can't Say (4),Carrying What You Can't Say — Boundaries for Tech Finance Burnout (The Hidden Weight of Shame),Say It,Ana Reyes,3,boundaries,shame,tech_finance_burnout,Worth & Limits
way_stream_sanctuary__default_teacher__tech_finance_burnout__burnout__grief,Burnout Recovery: The Grief That Doesn't Leave (5),How Tech Finance Burnout Are Rewriting the Rules of Burnout,Refill You,Ana Reyes,1,burnout,grief,tech_finance_burnout,Refill the Empty Well
way_stream_sanctuary__default_teacher__tech_finance_burnout__burnout__grief__1hr,Burnout Recovery: When Loss Reshapes Everything,A Real Talk Guide to Burnout for Tech Finance Burnout,Refill You,Ana Reyes,1,burnout,grief,tech_finance_burnout,Steady Ground
way_stream_sanctuary__default_teacher__tech_finance_burnout__burnout__overwhelm,Burnout Recovery: Drowning in Demands (6),A Field Guide for Tech Finance Burnout Navigating Burnout,Set It Down,Ana Reyes,2,burnout,overwhelm,tech_finance_burnout,Refill the Empty Well
way_stream_sanctuary__default_teacher__tech_finance_burnout__burnout__overwhelm__1hr,Burnout Recovery: When Everything Is Too Much (2),"Too Many Things, Not Enough You — Burnout for Tech Finance Burnout (When Everything Is Too Much)",Set It Down,Ana Reyes,2,burnout,overwhelm,tech_finance_burnout,Steady Ground
way_stream_sanctuary__default_teacher__tech_finance_burnout__burnout__watcher,Burnout Recovery: The Witnessing Practice (1),Watching Your Thoughts Without Drowning — Burnout for Tech Finance Burnout (Watching Your Thoughts Without Drowning),Just Watch,Ana Reyes,3,burnout,watcher,tech_finance_burnout,Refill the Empty Well
way_stream_sanctuary__default_teacher__tech_finance_burnout__burnout__watcher__1hr,Burnout Recovery: Watching Your Thoughts Without Drowning (4),The Witnessing Practice — Burnout for Tech Finance Burnout (The Observer's Mind),Make Space,Ana Reyes,3,burnout,watcher,tech_finance_burnout,Steady Ground
way_stream_sanctuary__default_teacher__tech_finance_burnout__compassion_fatigue__grief,Compassion Fatigue: The Grief That Doesn't Leave (3),A Real Talk Guide to Compassion Fatigue for Tech Finance Burnout,Refill You,Ana Reyes,1,compassion_fatigue,grief,tech_finance_burnout,Refill the Empty Well
way_stream_sanctuary__default_teacher__tech_finance_burnout__compassion_fatigue__overwhelm,The Cost of Caring: The Overwhelm Response,A Field Guide for Tech Finance Burnout Navigating Compassion Fatigue,Refill You,Ana Reyes,2,compassion_fatigue,overwhelm,tech_finance_burnout,Refill the Empty Well
way_stream_sanctuary__default_teacher__tech_finance_burnout__compassion_fatigue__watcher,The Cost of Caring: The Space Between You and Your Anxiety,How Tech Finance Burnout Are Rewriting the Rules of Compassion Fatigue,Tend You,Ana Reyes,3,compassion_fatigue,watcher,tech_finance_burnout,Refill the Empty Well
way_stream_sanctuary__default_teacher__tech_finance_burnout__courage__false_alarm,Building Courage: Misreading the Danger Signal (3),A Real Talk Guide to Courage for Tech Finance Burnout,Begin Again,Daniel Cho,1,courage,false_alarm,tech_finance_burnout,Brave in the World
way_stream_sanctuary__default_teacher__tech_finance_burnout__courage__false_alarm__1hr,Building Courage: Misreading the Danger Signal (4),A Field Guide for Tech Finance Burnout Navigating Courage,Begin Again,Daniel Cho,1,courage,false_alarm,tech_finance_burnout,Brave in the World
way_stream_sanctuary__default_teacher__tech_finance_burnout__courage__shame,Building Courage: Carrying What You Can't Say (3),How Tech Finance Burnout Are Rewriting the Rules of Courage,Brave Again,Daniel Cho,2,courage,shame,tech_finance_burnout,Brave in the World
way_stream_sanctuary__default_teacher__tech_finance_burnout__courage__shame__1hr,Building Courage: What Shame Does to You (4),When You Feel Fundamentally Wrong — Courage for Tech Finance Burnout (The Hidden Weight of Shame),Worthy Now,Daniel Cho,2,courage,shame,tech_finance_burnout,Brave in the World
way_stream_sanctuary__default_teacher__tech_finance_burnout__courage__spiral,Building Courage: The Rumination Trap (2),The Overthinking Spiral — Courage for Tech Finance Burnout (Breaking the Thought Loop),Break Loose,Daniel Cho,3,courage,spiral,tech_finance_burnout,Brave in the World
way_stream_sanctuary__default_teacher__tech_finance_burnout__courage__spiral__1hr,Building Courage: The Overthinking Spiral (1),Escaping the Mental Loop — Courage for Tech Finance Burnout (Breaking the Thought Loop),Step Forward,Daniel Cho,3,courage,spiral,tech_finance_burnout,Brave in the World
way_stream_sanctuary__default_teacher__tech_finance_burnout__depression__grief,Overcoming Depression: After the Loss (2),A Real Talk Guide to Depression for Tech Finance Burnout,Lift Slowly,Ana Reyes,1,depression,grief,tech_finance_burnout,Through the Low Places
way_stream_sanctuary__default_teacher__tech_finance_burnout__depression__grief__1hr,Overcoming Depression: The Grief That Doesn't Leave (6),A Field Guide for Tech Finance Burnout Navigating Depression,Find Your Way,Ana Reyes,1,depression,grief,tech_finance_burnout,Through the Low Places
way_stream_sanctuary__default_teacher__tech_finance_burnout__depression__overwhelm,Overcoming Depression: When Everything Is Too Much (2),How Tech Finance Burnout Are Rewriting the Rules of Depression,Ease the Load,Ana Reyes,2,depression,overwhelm,tech_finance_burnout,Through the Low Places
way_stream_sanctuary__default_teacher__tech_finance_burnout__depression__overwhelm__1hr,Overcoming Depression: The Shutdown Point (4),The Overwhelm Response — Depression for Tech Finance Burnout (The Overwhelm Response),One Step,Ana Reyes,2,depression,overwhelm,tech_finance_burnout,Through the Low Places
way_stream_sanctuary__default_teacher__tech_finance_burnout__depression__watcher,Overcoming Depression: The Witnessing Practice (2),Watching Your Thoughts Without Drowning — Depression for Tech Finance Burnout (Watching Your Thoughts Without Drowning),Just Watch,Ana Reyes,3,depression,watcher,tech_finance_burnout,Through the Low Places
way_stream_sanctuary__default_teacher__tech_finance_burnout__depression__watcher__1hr,Overcoming Depression: The Space Between You and Your Anxiety (1),Watching Your Thoughts Without Drowning — Depression for Tech Finance Burnout (The Observer's Mind),Step Back,Ana Reyes,3,depression,watcher,tech_finance_burnout,Through the Low Places
way_stream_sanctuary__default_teacher__tech_finance_burnout__financial_anxiety__overwhelm,Financial Anxiety: When Everything Is Too Much (5),A Real Talk Guide to Financial Anxiety for Tech Finance Burnout,Money Calm,Ana Reyes,1,financial_anxiety,overwhelm,tech_finance_burnout,Money Without Panic
way_stream_sanctuary__default_teacher__tech_finance_burnout__financial_anxiety__overwhelm__1hr,The Number in Your Head: The Shutdown Point,A Field Guide for Tech Finance Burnout Navigating Financial Anxiety,Find Footing,Ana Reyes,1,financial_anxiety,overwhelm,tech_finance_burnout,Steady Ground
way_stream_sanctuary__default_teacher__tech_finance_burnout__financial_anxiety__shame,Financial Anxiety: Carrying What You Can't Say (5),How Tech Finance Burnout Are Rewriting the Rules of Financial Anxiety,Worth Stays,Ana Reyes,2,financial_anxiety,shame,tech_finance_burnout,Money Without Panic
way_stream_sanctuary__default_teacher__tech_finance_burnout__financial_anxiety__shame__1hr,Financial Anxiety: What Shame Does to You (4),When You Feel Fundamentally Wrong — Financial Anxiety for Tech Finance Burnout (The Hidden Weight of Shame),Set It Down,Ana Reyes,2,financial_anxiety,shame,tech_finance_burnout,Steady Ground
way_stream_sanctuary__default_teacher__tech_finance_burnout__financial_anxiety__spiral,Financial Anxiety: Escaping the Mental Loop (4),A Step-by-Step Method to Interrupt Spiraling Thoughts Before They Take Over — Financial Anxiety for Tech Finance Burnout (The Overthinking Spiral),Stop Spiraling,Ana Reyes,3,financial_anxiety,spiral,tech_finance_burnout,Money Without Panic
way_stream_sanctuary__default_teacher__tech_finance_burnout__financial_anxiety__spiral__1hr,Financial Anxiety: The Overthinking Spiral (1),Escaping the Mental Loop — Financial Anxiety for Tech Finance Burnout (Breaking the Thought Loop),,Ana Reyes,3,financial_anxiety,spiral,tech_finance_burnout,Steady Ground
way_stream_sanctuary__default_teacher__tech_finance_burnout__financial_stress__overwhelm,Financial Stress Management: Drowning in Demands,A Real Talk Guide to Financial Stress for Tech Finance Burnout,Breathe Room,Ana Reyes,1,financial_stress,overwhelm,tech_finance_burnout,Money Without Panic
way_stream_sanctuary__default_teacher__tech_finance_burnout__financial_stress__shame,The Paycheck Pressure: The Shame Response (1),A Field Guide for Tech Finance Burnout Navigating Financial Stress,Steady Money,Ana Reyes,2,financial_stress,shame,tech_finance_burnout,Money Without Panic
way_stream_sanctuary__default_teacher__tech_finance_burnout__financial_stress__spiral,The Paycheck Pressure: When One Thought Becomes a Thousand (1),How Tech Finance Burnout Are Rewriting the Rules of Financial Stress,Quiet Money,Ana Reyes,3,financial_stress,spiral,tech_finance_burnout,Money Without Panic
way_stream_sanctuary__default_teacher__tech_finance_burnout__grief__grief,Grief: After the Loss (4),A Field Guide for Tech Finance Burnout Navigating Grief,Hold It Soft,Ana Reyes,1,grief,grief,tech_finance_burnout,Through the Low Places
way_stream_sanctuary__default_teacher__tech_finance_burnout__grief__grief__1hr,Grief: The Grief That Doesn't Leave (3),A Real Talk Guide to Grief for Tech Finance Burnout,Let It Land,Ana Reyes,1,grief,grief,tech_finance_burnout,Through the Low Places
way_stream_sanctuary__default_teacher__tech_finance_burnout__grief__watcher,Grief: Watching Your Thoughts Without Drowning (5),How Tech Finance Burnout Are Rewriting the Rules of Grief,Let It Be,Ana Reyes,2,grief,watcher,tech_finance_burnout,Through the Low Places
way_stream_sanctuary__default_teacher__tech_finance_burnout__grief__watcher__1hr,Grief: The Space Between You and Your Anxiety (3),How to Create Distance from Anxious Thoughts and Find Clarity — Grief for Tech Finance Burnout (The Observer's Mind),Find Clarity,Ana Reyes,2,grief,watcher,tech_finance_burnout,Through the Low Places
way_stream_sanctuary__default_teacher__tech_finance_burnout__imposter_syndrome__comparison,The Seat You Earned: When Other People's Success Feels Like Your Failure,A Real Talk Guide to Imposter Syndrome for Tech Finance Burnout,You Belong,Ana Reyes,1,imposter_syndrome,comparison,tech_finance_burnout,Worth & Limits
way_stream_sanctuary__default_teacher__tech_finance_burnout__imposter_syndrome__shame,Imposter Syndrome: When You Feel Fundamentally Wrong,A Field Guide for Tech Finance Burnout Navigating Imposter Syndrome,Owned Worth,Ana Reyes,2,imposter_syndrome,shame,tech_finance_burnout,Worth & Limits
way_stream_sanctuary__default_teacher__tech_finance_burnout__overthinking__false_alarm,The Thought That Won't Leave: When Fear Lies to You,A Real Talk Guide to Overthinking for Tech Finance Burnout,False Alarm,Daniel Cho,1,overthinking,false_alarm,tech_finance_burnout,Quiet the Restless Mind
way_stream_sanctuary__default_teacher__tech_finance_burnout__overthinking__false_alarm__1hr,Stop Overthinking: Misreading the Danger Signal (3),A Field Guide for Tech Finance Burnout Navigating Overthinking,Quiet Mind,Daniel Cho,1,overthinking,false_alarm,tech_finance_burnout,Quiet the Restless Mind
way_stream_sanctuary__default_teacher__tech_finance_burnout__overthinking__spiral,Stop Overthinking: When One Thought Becomes a Thousand (4),How Tech Finance Burnout Are Rewriting the Rules of Overthinking,Stop the Loop,Daniel Cho,2,overthinking,spiral,tech_finance_burnout,Quiet the Restless Mind
way_stream_sanctuary__default_teacher__tech_finance_burnout__overthinking__spiral__1hr,Stop Overthinking: The Rumination Trap,The Overthinking Spiral — Overthinking for Tech Finance Burnout (Breaking the Thought Loop),Break Loose,Daniel Cho,2,overthinking,spiral,tech_finance_burnout,Quiet the Restless Mind
way_stream_sanctuary__default_teacher__tech_finance_burnout__overthinking__watcher,Stop Overthinking: The Observer's Mind (1),The Space Between You and Your Anxiety — Overthinking for Tech Finance Burnout (The Observer's Mind),Just Watch,Daniel Cho,3,overthinking,watcher,tech_finance_burnout,Quiet the Restless Mind
way_stream_sanctuary__default_teacher__tech_finance_burnout__overthinking__watcher__1hr,Stop Overthinking: Stepping Back from the Storm (1),Stepping Back from the Storm — Overthinking for Tech Finance Burnout (The Observer's Mind),Step Back,Daniel Cho,3,overthinking,watcher,tech_finance_burnout,Quiet the Restless Mind
way_stream_sanctuary__default_teacher__tech_finance_burnout__self_worth__comparison,The Voice That Says Not Enough: Measuring Yourself Against Everyone (2),A Real Talk Guide to Self-Worth for Tech Finance Burnout,You Enough,Ana Reyes,1,self_worth,comparison,tech_finance_burnout,Worth & Limits
way_stream_sanctuary__default_teacher__tech_finance_burnout__self_worth__comparison__1hr,The Voice That Says Not Enough: The Comparison Trap (1),A Field Guide for Tech Finance Burnout Navigating Self-Worth,You Belong,Ana Reyes,1,self_worth,comparison,tech_finance_burnout,Worth & Limits
way_stream_sanctuary__default_teacher__tech_finance_burnout__self_worth__shame,The Voice That Says Not Enough: Carrying What You Can't Say (4),How Tech Finance Burnout Are Rewriting the Rules of Self-Worth,You Matter,Ana Reyes,2,self_worth,shame,tech_finance_burnout,Worth & Limits
way_stream_sanctuary__default_teacher__tech_finance_burnout__self_worth__shame__1hr,The Voice That Says Not Enough: When You Feel Fundamentally Wrong (2),The Shame Response — Self-Worth for Tech Finance Burnout (The Hidden Weight of Shame),,Ana Reyes,2,self_worth,shame,tech_finance_burnout,Worth & Limits
way_stream_sanctuary__default_teacher__tech_finance_burnout__sleep_anxiety__false_alarm,The 3am Mind: When Fear Lies to You,A Real Talk Guide to Sleep Anxiety for Tech Finance Burnout,Rest Easy,Daniel Cho,1,sleep_anxiety,false_alarm,tech_finance_burnout,Quiet the Restless Mind
way_stream_sanctuary__default_teacher__tech_finance_burnout__sleep_anxiety__false_alarm__1hr,Sleep Anxiety: When Fear Lies to You (1),A Field Guide for Tech Finance Burnout Navigating Sleep Anxiety,Sleep Safe,Daniel Cho,1,sleep_anxiety,false_alarm,tech_finance_burnout,Quiet the Restless Mind
way_stream_sanctuary__default_teacher__tech_finance_burnout__sleep_anxiety__overwhelm,Sleep Anxiety: The Shutdown Point (2),How Tech Finance Burnout Are Rewriting the Rules of Sleep Anxiety,Wind Down,Daniel Cho,2,sleep_anxiety,overwhelm,tech_finance_burnout,Quiet the Restless Mind
