book_id,title,subtitle,short_hook,author,installment,topic,engine,persona,cluster
way_stream_sanctuary__default_teacher__first_responders__courage__false_alarm__1hr,The Thing You Won't Say: Why Your Brain Cries Wolf,A Real Talk Guide to Courage for First Responders,Step Up,Cole Bennett,1,courage,false_alarm,first_responders,Brave in the World
way_stream_sanctuary__default_teacher__first_responders__courage__shame,Building Courage: What Shame Does to You,How First Responders Are Rewriting the Rules of Courage,Begin Again,Cole Bennett,2,courage,shame,first_responders,Brave in the World
way_stream_sanctuary__default_teacher__first_responders__courage__shame__1hr,Building Courage: The Hidden Weight of Shame,Understanding How Shame Works in Your Body and Mind — and How to Release It — Courage for First Responders (The Hidden Weight of Shame),Begin Again,Cole Bennett,2,courage,shame,first_responders,Brave in the World
way_stream_sanctuary__default_teacher__first_responders__courage__spiral,Building Courage: When One Thought Becomes a Thousand (1),The Overthinking Spiral — Courage for First Responders (Breaking the Thought Loop),Break Free,Cole Bennett,3,courage,spiral,first_responders,Brave in the World
way_stream_sanctuary__default_teacher__first_responders__courage__spiral__1hr,The Thing You Won't Say: The Overthinking Spiral,A Step-by-Step Method to Interrupt Spiraling Thoughts Before They Take Over — Courage for First Responders (Breaking the Thought Loop),Break Free,Cole Bennett,3,courage,spiral,first_responders,Brave in the World
way_stream_sanctuary__default_teacher__first_responders__depression__grief,The Weight Without a Name: The Grief That Doesn't Leave,A Real Talk Guide to Depression for First Responders,Find Light,Marcus Reed,1,depression,grief,first_responders,Through the Low Places
way_stream_sanctuary__default_teacher__first_responders__depression__grief__1hr,Overcoming Depression: The Grief That Doesn't Leave (1),A Field Guide for First Responders Navigating Depression,Find Light,Marcus Reed,1,depression,grief,first_responders,Through the Low Places
way_stream_sanctuary__default_teacher__first_responders__depression__overwhelm,Overcoming Depression: The Shutdown Point (1),How First Responders Are Rewriting the Rules of Depression,Lift It,Marcus Reed,2,depression,overwhelm,first_responders,Through the Low Places
way_stream_sanctuary__default_teacher__first_responders__depression__overwhelm__1hr,Overcoming Depression: The Shutdown Point (2),Drowning in Demands — Depression for First Responders (When Everything Is Too Much),,Marcus Reed,2,depression,overwhelm,first_responders,Through the Low Places
way_stream_sanctuary__default_teacher__first_responders__depression__watcher,The Weight Without a Name: The Observer's Mind,How to Create Distance from Anxious Thoughts and Find Clarity — Depression for First Responders (The Observer's Mind),Step Back,Marcus Reed,3,depression,watcher,first_responders,Through the Low Places
way_stream_sanctuary__default_teacher__first_responders__depression__watcher__1hr,Overcoming Depression: The Observer's Mind (1),Watching Your Thoughts Without Drowning — Depression for First Responders (Watching Your Thoughts Without Drowning),Step Back,Marcus Reed,3,depression,watcher,first_responders,Through the Low Places
way_stream_sanctuary__default_teacher__first_responders__financial_anxiety__overwhelm,Financial Anxiety: When Everything Is Too Much (2),A Real Talk Guide to Financial Anxiety for First Responders,Money Calm,Marcus Reed,1,financial_anxiety,overwhelm,first_responders,Money Without Panic
way_stream_sanctuary__default_teacher__first_responders__financial_anxiety__overwhelm__1hr,Financial Anxiety: The Overwhelm Response,A Field Guide for First Responders Navigating Financial Anxiety,Money Calm,Marcus Reed,1,financial_anxiety,overwhelm,first_responders,Steady Ground
way_stream_sanctuary__default_teacher__first_responders__financial_anxiety__shame,The Number in Your Head: What Shame Does to You,How First Responders Are Rewriting the Rules of Financial Anxiety,You Are Ok,Marcus Reed,2,financial_anxiety,shame,first_responders,Money Without Panic
way_stream_sanctuary__default_teacher__first_responders__financial_anxiety__shame__1hr,Financial Anxiety: Carrying What You Can't Say,When You Feel Fundamentally Wrong — Financial Anxiety for First Responders (The Hidden Weight of Shame),You Are Ok,Marcus Reed,2,financial_anxiety,shame,first_responders,Steady Ground
way_stream_sanctuary__default_teacher__first_responders__financial_anxiety__spiral,Financial Anxiety: Escaping the Mental Loop,A Step-by-Step Method to Interrupt Spiraling Thoughts Before They Take Over — Financial Anxiety for First Responders (The Overthinking Spiral),Break Free,Marcus Reed,3,financial_anxiety,spiral,first_responders,Money Without Panic
way_stream_sanctuary__default_teacher__first_responders__financial_anxiety__spiral__1hr,Financial Anxiety: Breaking the Thought Loop (1),The Rumination Trap — Financial Anxiety for First Responders (Breaking the Thought Loop),Break Free,Marcus Reed,3,financial_anxiety,spiral,first_responders,Steady Ground
way_stream_sanctuary__default_teacher__first_responders__financial_stress__overwhelm,The Paycheck Pressure: The Overwhelm Response,How First Responders Are Rewriting the Rules of Financial Stress,Money Calm,Marcus Reed,1,financial_stress,overwhelm,first_responders,Money Without Panic
way_stream_sanctuary__default_teacher__first_responders__financial_stress__shame,The Paycheck Pressure: Carrying What You Can't Say,A Real Talk Guide to Financial Stress for First Responders,Money Calm,Marcus Reed,2,financial_stress,shame,first_responders,Money Without Panic
way_stream_sanctuary__default_teacher__first_responders__financial_stress__spiral,The Paycheck Pressure: Breaking the Thought Loop,A Field Guide for First Responders Navigating Financial Stress,Ease The Load,Marcus Reed,3,financial_stress,spiral,first_responders,Money Without Panic
way_stream_sanctuary__default_teacher__first_responders__grief__grief,Grief: When Loss Reshapes Everything (1),A Real Talk Guide to Grief for First Responders,Let It Land,Marcus Reed,1,grief,grief,first_responders,Through the Low Places
way_stream_sanctuary__default_teacher__first_responders__grief__grief__1hr,Grief: After the Loss,A Field Guide for First Responders Navigating Grief,Let It Land,Marcus Reed,1,grief,grief,first_responders,Through the Low Places
way_stream_sanctuary__default_teacher__first_responders__grief__watcher,Grief: Stepping Back from the Storm,How First Responders Are Rewriting the Rules of Grief,Let It Land,Marcus Reed,2,grief,watcher,first_responders,Through the Low Places
way_stream_sanctuary__default_teacher__first_responders__grief__watcher__1hr,Grief: Watching Your Thoughts Without Drowning (1),Stepping Back from the Storm — Grief for First Responders (The Observer's Mind),,Marcus Reed,2,grief,watcher,first_responders,Through the Low Places
way_stream_sanctuary__default_teacher__first_responders__imposter_syndrome__comparison,Imposter Syndrome: Measuring Yourself Against Everyone,A Real Talk Guide to Imposter Syndrome for First Responders,You Belong,Marcus Reed,1,imposter_syndrome,comparison,first_responders,Worth & Limits
way_stream_sanctuary__default_teacher__first_responders__imposter_syndrome__shame,Imposter Syndrome: The Hidden Weight of Shame,A Field Guide for First Responders Navigating Imposter Syndrome,You Belong,Marcus Reed,2,imposter_syndrome,shame,first_responders,Worth & Limits
way_stream_sanctuary__default_teacher__first_responders__overthinking__false_alarm,Stop Overthinking: Misreading the Danger Signal,A Real Talk Guide to Overthinking for First Responders,Quiet Mind,Cole Bennett,1,overthinking,false_alarm,first_responders,Quiet the Restless Mind
way_stream_sanctuary__default_teacher__first_responders__overthinking__false_alarm__1hr,Stop Overthinking: When Fear Lies to You,A Field Guide for First Responders Navigating Overthinking,Quiet Mind,Cole Bennett,1,overthinking,false_alarm,first_responders,Quiet the Restless Mind
way_stream_sanctuary__default_teacher__first_responders__overthinking__spiral,The Thought That Won't Leave: Escaping the Mental Loop,How First Responders Are Rewriting the Rules of Overthinking,Break Free,Cole Bennett,2,overthinking,spiral,first_responders,Quiet the Restless Mind
way_stream_sanctuary__default_teacher__first_responders__overthinking__spiral__1hr,The Thought That Won't Leave: Breaking the Thought Loop,The Rumination Trap — Overthinking for First Responders (Breaking the Thought Loop),Break Free,Cole Bennett,2,overthinking,spiral,first_responders,Quiet the Restless Mind
way_stream_sanctuary__default_teacher__first_responders__overthinking__watcher,The Thought That Won't Leave: The Witnessing Practice,How to Create Distance from Anxious Thoughts and Find Clarity — Overthinking for First Responders (Watching Your Thoughts Without Drowning),Step Back,Cole Bennett,3,overthinking,watcher,first_responders,Quiet the Restless Mind
way_stream_sanctuary__default_teacher__first_responders__overthinking__watcher__1hr,Stop Overthinking: The Witnessing Practice (1),The Space Between You and Your Anxiety — Overthinking for First Responders (The Observer's Mind),Step Back,Cole Bennett,3,overthinking,watcher,first_responders,Quiet the Restless Mind
way_stream_sanctuary__default_teacher__first_responders__self_worth__comparison,The Voice That Says Not Enough: Beyond the Highlight Reel (1),How First Responders Are Rewriting the Rules of Self-Worth,Enough Now,Marcus Reed,1,self_worth,comparison,first_responders,Worth & Limits
way_stream_sanctuary__default_teacher__first_responders__self_worth__comparison__1hr,Building Self Worth: The Comparison Habit,A Field Guide for First Responders Navigating Self-Worth,Enough Now,Marcus Reed,1,self_worth,comparison,first_responders,Worth & Limits
way_stream_sanctuary__default_teacher__first_responders__self_worth__shame,The Voice That Says Not Enough: Carrying What You Can't Say,A Real Talk Guide to Self-Worth for First Responders,You Belong,Marcus Reed,2,self_worth,shame,first_responders,Worth & Limits
way_stream_sanctuary__default_teacher__first_responders__self_worth__shame__1hr,Building Self Worth: The Hidden Weight of Shame,Carrying What You Can't Say — Self-Worth for First Responders (The Hidden Weight of Shame),,Marcus Reed,2,self_worth,shame,first_responders,Worth & Limits
way_stream_sanctuary__default_teacher__first_responders__sleep_anxiety__false_alarm,Sleep Anxiety: Why Your Brain Cries Wolf,A Real Talk Guide to Sleep Anxiety for First Responders,Rest Easy,Cole Bennett,1,sleep_anxiety,false_alarm,first_responders,Quiet the Restless Mind
way_stream_sanctuary__default_teacher__first_responders__sleep_anxiety__false_alarm__1hr,The 3am Mind: Misreading the Danger Signal,A Field Guide for First Responders Navigating Sleep Anxiety,Rest Easy,Cole Bennett,1,sleep_anxiety,false_alarm,first_responders,Quiet the Restless Mind
way_stream_sanctuary__default_teacher__first_responders__sleep_anxiety__overwhelm,Sleep Anxiety: The Overwhelm Response,How First Responders Are Rewriting the Rules of Sleep Anxiety,Power Down,Cole Bennett,2,sleep_anxiety,overwhelm,first_responders,Quiet the Restless Mind
way_stream_sanctuary__default_teacher__first_responders__sleep_anxiety__overwhelm__1hr,The 3am Mind: Drowning in Demands,The Shutdown Point — Sleep Anxiety for First Responders (When Everything Is Too Much),Power Down,Cole Bennett,2,sleep_anxiety,overwhelm,first_responders,Quiet the Restless Mind
way_stream_sanctuary__default_teacher__first_responders__sleep_anxiety__spiral,Sleep Anxiety: Escaping the Mental Loop (1),When One Thought Becomes a Thousand — Sleep Anxiety for First Responders (Breaking the Thought Loop),Quiet Mind,Cole Bennett,3,sleep_anxiety,spiral,first_responders,Quiet the Restless Mind
way_stream_sanctuary__default_teacher__first_responders__sleep_anxiety__spiral__1hr,Sleep Anxiety: Escaping the Mental Loop (2),A Step-by-Step Method to Interrupt Spiraling Thoughts Before They Take Over — Sleep Anxiety for First Responders (The Overthinking Spiral),Break Free,Cole Bennett,3,sleep_anxiety,spiral,first_responders,Quiet the Restless Mind
way_stream_sanctuary__default_teacher__first_responders__social_anxiety__comparison,Social Anxiety: The Comparison Habit,A Field Guide for First Responders Navigating Social Anxiety,Just Be You,Cole Bennett,1,social_anxiety,comparison,first_responders,Brave in the World
way_stream_sanctuary__default_teacher__first_responders__social_anxiety__comparison__1hr,Social Anxiety: Beyond the Highlight Reel (3),A Real Talk Guide to Social Anxiety for First Responders,Just Be You,Cole Bennett,1,social_anxiety,comparison,first_responders,Brave in the World
way_stream_sanctuary__default_teacher__first_responders__social_anxiety__false_alarm,Social Anxiety: When Fear Lies to You,How First Responders Are Rewriting the Rules of Social Anxiety,Ease In,Cole Bennett,2,social_anxiety,false_alarm,first_responders,Brave in the World
way_stream_sanctuary__default_teacher__first_responders__social_anxiety__false_alarm__1hr,Social Anxiety: When Fear Lies to You (1),How to Recognize When Anxiety Is a False Alarm — and What to Do Instead — Social Anxiety for First Responders (When Your Mind Screams Danger),Ease In,Cole Bennett,2,social_anxiety,false_alarm,first_responders,Brave in the World
way_stream_sanctuary__default_teacher__first_responders__social_anxiety__shame,Social Anxiety: Carrying What You Can't Say,Understanding How Shame Works in Your Body and Mind — and How to Release It — Social Anxiety for First Responders (What Shame Does to You),You Belong,Cole Bennett,3,social_anxiety,shame,first_responders,Brave in the World
way_stream_sanctuary__default_teacher__first_responders__social_anxiety__shame__1hr,Social Anxiety: Carrying What You Can't Say (1),When You Feel Fundamentally Wrong — Social Anxiety for First Responders (The Hidden Weight of Shame),Not Broken,Cole Bennett,3,social_anxiety,shame,first_responders,Brave in the World
way_stream_sanctuary__default_teacher__first_responders__somatic_healing__overwhelm,What the Body Remembers: The Overwhelm Response,A Real Talk Guide to Somatic Healing for First Responders,Body First,Marcus Reed,1,somatic_healing,overwhelm,first_responders,Through the Low Places
way_stream_sanctuary__default_teacher__first_responders__somatic_healing__watcher,Somatic Healing: The Witnessing Practice (1),A Field Guide for First Responders Navigating Somatic Healing,Notice It,Marcus Reed,2,somatic_healing,watcher,first_responders,Through the Low Places
way_stream_sanctuary__default_teacher__gen_alpha_students__anxiety__comparison,Anxiety Relief: Beyond the Highlight Reel (1),A Field Guide for Gen Alpha Students Navigating Anxiety,Your Own Pace,Nina Vazquez,1,anxiety,comparison,gen_alpha_students,
way_stream_sanctuary__default_teacher__gen_alpha_students__anxiety__comparison__1hr,Anxiety Relief: Beyond the Highlight Reel (2),A Real Talk Guide to Anxiety for Gen Alpha Students,Just Yours,Nina Vazquez,1,anxiety,comparison,gen_alpha_students,Calm the Alarm
way_stream_sanctuary__default_teacher__gen_alpha_students__anxiety__false_alarm,The Alarm Is Lying: Why Your Brain Cries Wolf,How Gen Alpha Students Are Rewriting the Rules of Anxiety,False Alarm,Nina Vazquez,2,anxiety,false_alarm,gen_alpha_students,
way_stream_sanctuary__default_teacher__gen_alpha_students__anxiety__false_alarm__1hr,Anxiety Relief: The False Alarm Response (1),The False Alarm Response — Anxiety for Gen Alpha Students (When Your Mind Screams Danger),Not Danger,Nina Vazquez,2,anxiety,false_alarm,gen_alpha_students,Calm the Alarm
way_stream_sanctuary__default_teacher__gen_alpha_students__anxiety__grief,The Alarm Is Lying: The Grief That Doesn't Leave,After the Loss — Anxiety for Gen Alpha Students (The Weight You Carry),,Nina Vazquez,3,anxiety,grief,gen_alpha_students,
way_stream_sanctuary__default_teacher__gen_alpha_students__anxiety__grief__1hr,Anxiety Relief: After the Loss (1),Living with What You've Lost — Anxiety for Gen Alpha Students (The Weight You Carry),Hold It Soft,Nina Vazquez,3,anxiety,grief,gen_alpha_students,Calm the Alarm
way_stream_sanctuary__default_teacher__gen_alpha_students__anxiety__overwhelm,Anxiety Relief: The Overwhelm Response,"Too Many Things, Not Enough You — Anxiety for Gen Alpha Students (When Everything Is Too Much)",One Thing,Nina Vazquez,4,anxiety,overwhelm,gen_alpha_students,
way_stream_sanctuary__default_teacher__gen_alpha_students__anxiety__overwhelm__1hr,Anxiety Relief: The Shutdown Point (1),Practical Tools to Regain Control When Life Feels Unmanageable — Anxiety for Gen Alpha Students (When Everything Is Too Much),Take It Back,Nina Vazquez,4,anxiety,overwhelm,gen_alpha_students,Calm the Alarm
way_stream_sanctuary__default_teacher__gen_alpha_students__anxiety__shame,Anxiety Relief: Carrying What You Can't Say (2),Understanding How Shame Works in Your Body and Mind — and How to Release It — Anxiety for Gen Alpha Students (The Hidden Weight of Shame),Set It Down,Nina Vazquez,5,anxiety,shame,gen_alpha_students,
way_stream_sanctuary__default_teacher__gen_alpha_students__anxiety__shame__1hr,Anxiety Relief: When You Feel Fundamentally Wrong,Carrying What You Can't Say — Anxiety for Gen Alpha Students (The Hidden Weight of Shame),Say It Now,Nina Vazquez,5,anxiety,shame,gen_alpha_students,Calm the Alarm
way_stream_sanctuary__default_teacher__gen_alpha_students__anxiety__spiral,Anxiety Relief: When One Thought Becomes a Thousand,A Step-by-Step Method to Interrupt Spiraling Thoughts Before They Take Over — Anxiety for Gen Alpha Students (Breaking the Thought Loop),Loop No More,Nina Vazquez,6,anxiety,spiral,gen_alpha_students,
way_stream_sanctuary__default_teacher__gen_alpha_students__anxiety__spiral__1hr,The Alarm Is Lying: When One Thought Becomes a Thousand,"A Step-by-Step Method to Interrupt Spiraling Thoughts Before They Take Over — Anxiety for Gen Alpha Students (Breaking the Thought Loop, 1)",Stop Spiraling,Nina Vazquez,6,anxiety,spiral,gen_alpha_students,Calm the Alarm
way_stream_sanctuary__default_teacher__gen_alpha_students__anxiety__watcher,The Alarm Is Lying: Watching Your Thoughts Without Drowning,Watching Your Thoughts Without Drowning — Anxiety for Gen Alpha Students (Watching Your Thoughts Without Drowning),Just Watch,Nina Vazquez,7,anxiety,watcher,gen_alpha_students,
way_stream_sanctuary__default_teacher__gen_alpha_students__anxiety__watcher__1hr,Anxiety Relief: The Observer's Mind (1),Stepping Back from the Storm — Anxiety for Gen Alpha Students (The Observer's Mind),Step Back,Nina Vazquez,7,anxiety,watcher,gen_alpha_students,Calm the Alarm
way_stream_sanctuary__default_teacher__gen_alpha_students__boundaries__comparison,Setting Boundaries: Measuring Yourself Against Everyone,A Real Talk Guide to Boundaries for Gen Alpha Students,Your Line,Jonah Kim,1,boundaries,comparison,gen_alpha_students,Worth & Limits
way_stream_sanctuary__default_teacher__gen_alpha_students__boundaries__comparison__1hr,Setting Boundaries: Beyond the Highlight Reel (1),A Field Guide for Gen Alpha Students Navigating Boundaries,Hold Firm,Jonah Kim,1,boundaries,comparison,gen_alpha_students,Worth & Limits
way_stream_sanctuary__default_teacher__gen_alpha_students__boundaries__false_alarm,The Line You Never Drew: The False Alarm Response,How Gen Alpha Students Are Rewriting the Rules of Boundaries,Believe You,Jonah Kim,2,boundaries,false_alarm,gen_alpha_students,Worth & Limits
way_stream_sanctuary__default_teacher__gen_alpha_students__boundaries__false_alarm__1hr,Setting Boundaries: The False Alarm Response (1),The False Alarm Response — Boundaries for Gen Alpha Students (When Your Mind Screams Danger),Clean No,Jonah Kim,2,boundaries,false_alarm,gen_alpha_students,Worth & Limits
way_stream_sanctuary__default_teacher__gen_alpha_students__boundaries__shame,Setting Boundaries: Carrying What You Can't Say (1),What Shame Does to You — Boundaries for Gen Alpha Students (The Hidden Weight of Shame),Blameless,Jonah Kim,3,boundaries,shame,gen_alpha_students,Worth & Limits
way_stream_sanctuary__default_teacher__gen_alpha_students__boundaries__shame__1hr,Setting Boundaries: Carrying What You Can't Say (2),Understanding How Shame Works in Your Body and Mind — and How to Release It — Boundaries for Gen Alpha Students (The Hidden Weight of Shame),Set It Free,Jonah Kim,3,boundaries,shame,gen_alpha_students,Worth & Limits
way_stream_sanctuary__default_teacher__gen_alpha_students__burnout__grief,After the Flame: Living with What You've Lost,A Real Talk Guide to Burnout for Gen Alpha Students,Refill You,Jonah Kim,1,burnout,grief,gen_alpha_students,Refill the Empty Well
way_stream_sanctuary__default_teacher__gen_alpha_students__burnout__grief__1hr,Burnout Recovery: Living with What You've Lost (1),A Field Guide for Gen Alpha Students Navigating Burnout,You First,Jonah Kim,1,burnout,grief,gen_alpha_students,Steady Ground
way_stream_sanctuary__default_teacher__gen_alpha_students__burnout__overwhelm,After the Flame: The Overwhelm Response,How Gen Alpha Students Are Rewriting the Rules of Burnout,Less On You,Jonah Kim,2,burnout,overwhelm,gen_alpha_students,Refill the Empty Well
way_stream_sanctuary__default_teacher__gen_alpha_students__burnout__overwhelm__1hr,Burnout Recovery: Drowning in Demands (1),Drowning in Demands — Burnout for Gen Alpha Students (When Everything Is Too Much),Power Down,Jonah Kim,2,burnout,overwhelm,gen_alpha_students,Steady Ground
way_stream_sanctuary__default_teacher__gen_alpha_students__burnout__watcher,After the Flame: The Space Between You and Your Anxiety,How to Create Distance from Anxious Thoughts and Find Clarity — Burnout for Gen Alpha Students (Watching Your Thoughts Without Drowning),Let It Pass,Jonah Kim,3,burnout,watcher,gen_alpha_students,Refill the Empty Well
way_stream_sanctuary__default_teacher__gen_alpha_students__burnout__watcher__1hr,Burnout Recovery: The Space Between You and Your Anxiety (1),"How to Create Distance from Anxious Thoughts and Find Clarity — Burnout for Gen Alpha Students (Watching Your Thoughts Without Drowning, 1)",Make Space,Jonah Kim,3,burnout,watcher,gen_alpha_students,Steady Ground
way_stream_sanctuary__default_teacher__gen_alpha_students__compassion_fatigue__grief,The Cost of Caring: Living with What You've Lost,A Real Talk Guide to Compassion Fatigue for Gen Alpha Students,Refill First,Jonah Kim,1,compassion_fatigue,grief,gen_alpha_students,Refill the Empty Well
way_stream_sanctuary__default_teacher__gen_alpha_students__compassion_fatigue__overwhelm,The Cost of Caring: When Everything Is Too Much,A Field Guide for Gen Alpha Students Navigating Compassion Fatigue,Care For You,Jonah Kim,2,compassion_fatigue,overwhelm,gen_alpha_students,Refill the Empty Well
way_stream_sanctuary__default_teacher__gen_alpha_students__compassion_fatigue__watcher,The Cost of Caring: Stepping Back from the Storm,How Gen Alpha Students Are Rewriting the Rules of Compassion Fatigue,Step Away,Jonah Kim,3,compassion_fatigue,watcher,gen_alpha_students,Refill the Empty Well
way_stream_sanctuary__default_teacher__gen_alpha_students__courage__false_alarm,The Thing You Won't Say: The False Alarm Response,A Real Talk Guide to Courage for Gen Alpha Students,Brave Anyway,Nina Vazquez,1,courage,false_alarm,gen_alpha_students,Brave in the World
way_stream_sanctuary__default_teacher__gen_alpha_students__courage__false_alarm__1hr,Building Courage: The False Alarm Response (1),How Gen Alpha Students Are Rewriting the Rules of Courage,Be Brave,Nina Vazquez,1,courage,false_alarm,gen_alpha_students,Brave in the World
way_stream_sanctuary__default_teacher__gen_alpha_students__courage__shame,Building Courage: Carrying What You Can't Say (1),A Field Guide for Gen Alpha Students Navigating Courage,Show Up,Nina Vazquez,2,courage,shame,gen_alpha_students,Brave in the World
way_stream_sanctuary__default_teacher__gen_alpha_students__courage__shame__1hr,Building Courage: Carrying What You Can't Say (2),Understanding How Shame Works in Your Body and Mind — and How to Release It — Courage for Gen Alpha Students (What Shame Does to You),You Belong,Nina Vazquez,2,courage,shame,gen_alpha_students,Brave in the World
way_stream_sanctuary__default_teacher__gen_alpha_students__courage__spiral,The Thing You Won't Say: Escaping the Mental Loop,The Overthinking Spiral — Courage for Gen Alpha Students (Breaking the Thought Loop),Calm The Loop,Nina Vazquez,3,courage,spiral,gen_alpha_students,Brave in the World
way_stream_sanctuary__default_teacher__gen_alpha_students__courage__spiral__1hr,Building Courage: The Rumination Trap,A Step-by-Step Method to Interrupt Spiraling Thoughts Before They Take Over — Courage for Gen Alpha Students (The Overthinking Spiral),Stop The Spin,Nina Vazquez,3,courage,spiral,gen_alpha_students,Brave in the World
way_stream_sanctuary__default_teacher__gen_alpha_students__depression__grief,Overcoming Depression: Living with What You've Lost (1),A Field Guide for Gen Alpha Students Navigating Depression,Heavy Days,Jonah Kim,1,depression,grief,gen_alpha_students,Through the Low Places
way_stream_sanctuary__default_teacher__gen_alpha_students__depression__grief__1hr,Overcoming Depression: The Grief That Doesn't Leave (2),A Real Talk Guide to Depression for Gen Alpha Students,Lighter Soon,Jonah Kim,1,depression,grief,gen_alpha_students,Through the Low Places
way_stream_sanctuary__default_teacher__gen_alpha_students__depression__overwhelm,Overcoming Depression: Drowning in Demands,How Gen Alpha Students Are Rewriting the Rules of Depression,Too Much Now,Jonah Kim,2,depression,overwhelm,gen_alpha_students,Through the Low Places
